Count of Account name,Account name,Description_E,BN/Registration Number,Category English Desc,Sub-Category English Desc,Count of BN/Registration Number,Percent,City,Contact URL,Legal name,Mailing address,Postal code,Registration date
1,"""POLANIE"" POLISH SONG & DANCE ASSOCIATION",Charitable Organization,104256581RR0001,Arts,Other,3,100,CALGARY,WWW.POLANIE.CA,POLANIE POLISH SONG & DANCE ASSOCIATION,3015 - 15 ST N.E.,T2E7L8,1988-04-01 00:00:00
1,Abundant Life Church Society,Charitable Organization,814807624RR0001,Christianity,Baptist,3,100,CALGARY,ALC-CALGARY,Abundant Life Church Society,3325 49 ST SW,T3E6M6,1967-01-01 00:00:00
1,ALBERTA SCIENCE NETWORK: AN ALBERTA SOCIETY,Charitable Organization,129079315RR0001,Support of schools and education,Other,3,100,CALGARY,WWW.ALBERTASCIENCENETWORK.CA,ALBERTA SCIENCE NETWORK: AN ALBERTA SOCIETY,"70 HIGH STREET SE, PO BOX 89088",T2Z3V1,1991-07-01 00:00:00
1,AL-MADINAH CALGARY ISLAMIC ASSEMBLY,Charitable Organization,841674674RR0001,Islam,Other,3,100,CALGARY,"",AL-MADINAH CALGARY ISLAMIC ASSEMBLY,4616 80 AVE NE,T3J4B7,2006-01-01 00:00:00
1,Altalma Foundation,Charitable Organization,851124818RR0001,Organizations Relieving Poverty,Other,3,100,CALGARY,WWW.WENTWORTHFOUNDATION.COM,ALTALMA FOUNDATION,39 ASPEN CLIFF CLOSE SW,T3H0M1,2007-06-28 00:00:00
1,Bangladesh Puja Parishad of Calgary,Private Foundation,778190488RR0001,Other Religions,Hinduism,3,100,CALGARY,"",Bangladesh Puja Parishad of Calgary,51 SADDLELAKE PL NE,T3J0M5,2019-04-01 00:00:00
1,BONNIE & DARYL HOWARD CHARITABLE FOUNDATION,Private Foundation,889779195RR0001,Foundations,Foundations for specified community benefit,3,85,CALGARY,"",BONNIE & DARYL HOWARD CHARITABLE FOUNDATION,4131 CRESTVIEW ROAD S.W.,T2T2L5,1996-08-01 00:00:00
1,CALGARY CEREBRAL PALSY ASSOCIATION,Charitable Organization,118823277RR0001,Core Health Care,Other,3,100,CALGARY,WWW.CALGARYCP.ORG,CALGARY CEREBRAL PALSY ASSOCIATION,121-7015 MACLEOD TRAIL SW,T2H2K6,1993-11-20 00:00:00
1,CALGARY CHINESE MENNONITE CHURCH,Charitable Organization,892797770RR0001,Christianity,Mennonite / Brethren / Hutterite,3,100,CALGARY,"",CALGARY HOPE CHRISTIAN COMMUNITY CHURCH,1237 28 ST SE,T2A7G4,1985-12-01 00:00:00
1,CALGARY DROP-IN & REHAB CENTRE SOCIETY,Charitable Organization,118823459RR0001,Organizations Relieving Poverty,Other,3,100,CALGARY,WWW.THEDI.CA,CALGARY DROP-IN & REHAB CENTRE SOCIETY,1 DERMOT BALDWIN WAY S.E.,T2G0P8,1967-01-01 00:00:00
1,Calgary Evangelism Short Term Mission Society,Charitable Organization,834133258RR0001,Support of Religion,Other,3,100,CALGARY,"",CALGARY EVANGELISM SHORT TERM MISSION SOCIETY,5627 BRENNER CRES NW,T2L1Z3,2009-11-20 00:00:00
1,CALGARY KOREAN BAPTIST CHURCH,Charitable Organization,118823707RR0001,Christianity,Other,3,100,CALGARY,WWW.CALGARYKB.NET,CALGARY KOREAN BAPTIST CHURCH,805 77 AVE SW,T2V0T2,1984-07-25 00:00:00
1,CALGARY LEGAL GUIDANCE SOCIETY,Charitable Organization,118823715RR0001,Community Resource,Other,3,100,CALGARY,WWW.CLG.AB.CA,CALGARY LEGAL GUIDANCE SOCIETY,100 840 7TH AVE SW,T2P3G2,1982-04-01 00:00:00
1,CALGARY MILITARY FAMILY RESOURCE CENTRE/CENTRE DE RESSOURCESPOUR LES FAMILLES DES MILITAIRES,Charitable Organization,129175667RR0001,Organizations Relieving Poverty,Other,3,65,CALGARY,WWW.CALGARYMFRC.CA,CALGARY MILITARY FAMILY RESOURCE CENTRE/CENTRE DE RESSOURCE S POUR LES FAMILLES DES MILITAIRES,"203, 4225 CROWCHILD TRAIL SW",T3E1T8,1991-03-01 00:00:00
1,Calgary Towhid Centre,Charitable Organization,750777922RR0001,Islam,Other,3,100,CALGARY,"",CALGARY TOWHID CENTRE,21A - 416 MERIDIAN RD SE,T2A1X2,2016-08-19 00:00:00
1,CALGARY YOUNG PEOPLE'S THEATRE SOCIETY,Charitable Organization,895328367RR0001,Arts,Other,3,100,CALGARY,WWW.CYPT.CA,CALGARY YOUNG PEOPLE'S THEATRE SOCIETY,2007 10 AVE SW,T3C0K4,1992-06-10 00:00:00
1,CALGARY(ALBERTA) NEUROPATHY ASSOCIATION,Charitable Organization,863673984RR0001,Core Health Care,Treatment / preventative care for specific disease / health condition,3,100,CALGARY,CALGARYNEUROPATHY.COM,CALGARY (ALBERTA) NEUROPATHY ASSOCIATION,PO BOX 72068 RPO GLENMORE,T2V5H9,2005-04-19 00:00:00
1,Calvary Praise Church of Calgary,Charitable Organization,758193924RR0001,Christianity,Other,3,100,CALGARY,WWW.CALVARYPRAISECHURCH.CA,CALVARY PRAISE CHURCH OF CALGARY,94 SAGE HILL WAY NW,T3R0H3,2017-01-01 00:00:00
1,CANADIAN ASSOCIATION OF AFRICAN STUDIES-ASSOCIATION CANADIENNE DES ETUDES AFRICAINES,Charitable Organization,118829316RR0001,Teaching Institutions,Other,3,95,CALGARY,WWW.CAAS-ACEA.ORG,CANADIAN ASSOCIATION OF AFRICAN STUDIES-ASSOCIATION CANADIEN,18 TUSCANY ESTATES DR NW,T3L2Z5,1987-04-01 00:00:00
1,CARMEL GOSPEL ASSEMBLY CALGARY,Charitable Organization,738710292RR0001,Christianity,Other,3,100,CALGARY,WWW.CGAC.CHURCH,CARMEL GOSPEL ASSEMBLY CALGARY,1101 - 240 SKYVIEW RANCH RD NE,T3N0P4,2017-04-20 00:00:00
1,CENTRE FOR AFFORDABLE WATER AND SANITATION TECHNOLOGY(CAWST),Charitable Organization,863751616RR0001,Supportive Health Care,Other,3,100,CALGARY,WWW.CAWST.ORG,CENTRE FOR AFFORDABLE WATER AND SANITATION TECHNOLOGY (CAWST),B12 - 6020 2 ST SE,T2H2L8,2002-01-01 00:00:00
1,Centre for Newcomers Society of Calgary,Charitable Organization,100731660RR0001,Organizations Relieving Poverty,Other,3,100,CALGARY,WWW.CENTREFORNEWCOMERS.CA,CENTRE FOR NEWCOMERS SOCIETY OF CALGARY,125 - 565 36 ST NE,T2A6K3,1989-02-10 00:00:00
1,Centre for Sexuality Society,Charitable Organization,129209219RR0001,Organizations Relieving Poverty,Other,3,80,CALGARY,WWW.CALGARYSEXUALHEALTH.CA,Centre for Sexuality Society,700 - 1509 CENTRE ST SW,T2G2E6,1972-06-27 00:00:00
1,"CENTRE FOR SUICIDE PREVENTION, 2005",Charitable Organization,823280870RR0001,Community Resource,Suicide prevention,3,100,CALGARY,WWW.SUICIDEINFO.CA,"Centre for Suicide Prevention, 2005",320-105 12TH AVE SE,T2G1A1,2006-04-01 00:00:00
1,COMMUNITY OF CHRIST MEADOWRIDGE MISSION,Charitable Organization,129892659RR0082,Christianity,Other,3,100,CALGARY,"",COMMUNITY OF CHRIST,1185 STRATHCONA DR SW,T3H4S1,1992-08-01 00:00:00
1,Community Transcultural Support Services,Charitable Organization,855579512RR0001,Core Health Care,Community health centre/ medical clinic,3,100,CALGARY,WWW.COMMUNITYTRANSCULTURALSUPPORTSERVICES.ORG,Community Transcultural Support Services,40 LEGACY CIR SE,T2X0W8,2010-12-15 00:00:00
1,CROSS COUNTRY CHRISTIAN ENTERPRISES,Charitable Organization,118880038RR0001,Support of Religion,Other,3,100,CALGARY,WWW.GENTLEHANDSINC.ORG,CROSS COUNTRY CHRISTIAN ENTERPRISES,PO BOX 771 STN M,T2P2J3,1975-09-29 00:00:00
1,CROSSROADS COMMUNITY ASSOCIATION,Charitable Organization,892199969RR0001,Public Amenities,Community Centre / hall,3,,CALGARY,"",CROSSROADS COMMUNITY ASSOCIATION,1803 14 AVE NE,T2E1G4,1996-03-23 00:00:00
1,CUPS Calgary Society,Charitable Organization,134112515RR0001,Organizations Relieving Poverty,Other,3,100,CALGARY,WWW.CUPSCALGARY.COM,CUPS CALGARY SOCIETY,1001 10 AVE SW,T2R0B7,1989-04-01 00:00:00
1,DASHMESH CULTURE CENTRE,Charitable Organization,107002479RR0001,Christianity,Other,3,100,CALGARY,WWW.DASHMESH.CA,DASHMESH CULTURE CENTRE,135 MARTINDALE BLVD NE,T3J2X5,1994-04-28 00:00:00
1,Dominion Gospel Assembly Centre,Charitable Organization,832682736RR0001,Christianity,Other,3,100,CALGARY,"",DOMINION GOSPEL ASSEMBLY CENTRE,1120 PANORAMA HILLS DRIVE NW,T3K5V2,2012-12-07 00:00:00
1,EBENEZER INTERNATIONAL CHRISTIAN FELLOWSHIP OF CALGARY,Charitable Organization,857404636RR0001,Christianity,Other,3,100,CALGARY,"",EBENEZER INTERNATIONAL CHRISTIAN FELLOWSHIP OF CALGARY,148 PINEMEADOW RD NE,T1Y4N9,2005-02-07 00:00:00
1,Equip International Recovery Group Inc.,Charitable Organization,890791569RR0001,Support of Religion,Other,3,100,CALGARY,"",Equip International Recovery Group Inc.,458 35 AVE NW,T3K0C1,1994-02-14 00:00:00
1,Faith Beyond Belief,Charitable Organization,871450698RR0001,Christianity,Other,3,100,CALGARY,WWW.FAITHBEYONDBELIEF.CA,Faith Beyond Belief,PO BOX 95007 RPO SADDLERIDGE,T3J0E3,1997-07-01 00:00:00
1,"FIMES, Forum international de meditation des ecritures Saintes de Calgary",Charitable Organization,838539385RR0001,Support of Religion,Other,3,100,CALGARY,WWW.FIMES.INFO,Forum International de Meditation des Ecritures Saintes de Calgary,2536-10 AVENUE SOUTHEAST,T2A0C1,2015-02-13 00:00:00
1,Foothills Alliance Church,Charitable Organization,118927086RR0001,Christianity,Other,3,100,CALGARY,FOOTHILLSALLIANCE.COM,FOOTHILLS ALLIANCE CHURCH,333 EDGEPARK BLVD NW,T3A4K4,1967-01-01 00:00:00
1,FOOTHILLS LAND TRUST,Charitable Organization,883913006RR0001,Community Resource,Community land trust,3,100,CALGARY,WWW.FOOTHILLSLANDTRUST.ORG,FOOTHILLS LAND TRUST,"PO BOX 18066, RPO SHAWHESSY",T2Y0K3,2003-09-10 00:00:00
1,FRIENDS CHURCH (CALGARY) FELLOWSHIP,Charitable Organization,878494962RR0001,Christianity,Other,3,100,CALGARY,WWW.friendschurch.ca,FRIENDS CHURCH (CALGARY) FELLOWSHIP,#900-47TH AVE SW,T2S3C8,1997-06-27 00:00:00
1,FRIENDS OF FISH CREEK PROVINCIAL PARK SOCIETY,Charitable Organization,891199747RR0001,Public Amenities,Heritage / Historical site,3,85,CALGARY,WWW.FRIENDSOFFISHCREEK.ORG,FRIENDS OF FISH CREEK PROVINCIAL PARK SOCIETY,PO BOX 2780 STN M,T2P2M7,1994-06-01 00:00:00
1,FULL GOSPEL MISSION CHURCH OF NORTH CALGARY,Charitable Organization,899982300RR0001,Christianity,Other,3,100,CALGARY,CALGARY.ONMAM.COM,FULL GOSPEL MISSION CHURCH OF NORTH CALGARY,332 - 4303 1 ST NE,T2E7M3,2004-01-05 00:00:00
1,Gateway Victory Church of Calgary,Charitable Organization,763868122RR0001,Christianity,Other,3,100,CALGARY,GATEWAYVICTORY.COM,GATEWAY VICTORY CHURCH OF CALGARY,"SUITE 160, #5, 8720 MACLEOD TRAIL SE",T2H0M4,2017-01-01 00:00:00
1,Ghost River Theatre Society,Charitable Organization,869566745RR0001,Education in the arts,Theatre / film / drama school / society / company,3,100,CALGARY,WWW.GHOSTRIVERTHEATRE.COM,GHOST RIVER THEATRE SOCIETY,2007 10 AVE SW,T3C0K4,2007-10-17 00:00:00
1,Harvest International Baptist Church (Calgary),Private Foundation,809442593RR0001,Christianity,Other,3,100,CALGARY,"",HARVEST INTERNATIONAL BAPTIST CHURCH (CALGARY),216 CANTRELL PL SW,T2W1X3,2016-01-01 00:00:00
1,HELPING YOUTH THROUGH EDUCATIONAL SCHOLARSHIPS,Charitable Organization,828039545RR0001,Support of schools and education,Scholarships / bursaries / awards (scholastic achievement),3,100,CALGARY,WWW.HTYES.ORG,HELPING YOUTH THROUGH EDUCATIONAL SCHOLARSHIPS,4676 QUENTIN ST SW,T2T6E1,2005-07-19 00:00:00
1,IN HIS PRESENCE APOSTOLIC MINISTRIES,Charitable Organization,864308622RR0001,Christianity,Pentecostal,3,100,CALGARY,"",IN HIS PRESENCE APOSTOLIC MINISTRIES,432 LEGACY BLVD SE,T2X2C8,2003-08-14 00:00:00
1,International Support for Acid and Burn Survivors Canada,Charitable Organization,811953223RR0001,Supportive Health Care,Other,3,80,CALGARY,WWW.ISABS.CA,Acid Survivors Trust International Canada,315 SIERRA MORENA GREEN SW.,T3H3H8,2009-09-15 00:00:00
1,"Jesus, The Hope of Glory Pentecostal Church",Charitable Organization,752421891RR0001,Christianity,Pentecostal,3,100,CALGARY,"","JESUS, THE HOPE OF GLORY PENTECOSTAL CHURCH",1346 NEW BRIGHTON PK SE,T2Z0Y2,2016-08-11 00:00:00
1,JUBILEE CHRISTIAN CENTRE CHURCH,Charitable Organization,136814936RR0001,Christianity,Other,3,100,CALGARY,WWW.JUBILEECALGARY.COM,JUBILEE CHRISTIAN CENTRE CHURCH,458-35 AVENUE NW,T2K0C1,1993-01-01 00:00:00
1,KIDZTOWN SOCIETY MINISTRY TO CHILDREN,Charitable Organization,857330476RR0001,Support of Religion,Other,3,100,CALGARY,WWW.KIDZTOWN.NET,KIDZTOWN SOCIETY MINISTRY TO CHILDREN,32023 SPRINGBANK RD,T3Z2E3,2005-07-29 00:00:00
1,KNIGHTS OF THE IMMACULATA ASSOCIATION,Charitable Organization,889016259RR0001,Support of Religion,Mission / Missionary organization,3,90,CALGARY,"",KNIGHTS OF THE IMMACULATA ASSOCIATION,26 EVERGLADE WAY S.W.,T2Y4N2,1996-05-01 00:00:00
1,KOREAN FIRST METHODIST CHURCH IN CALGARY,Charitable Organization,892661638RR0001,Christianity,Other,3,100,CALGARY,calgarykm.com,KOREAN FIRST METHODIST CHURCH IN CALGARY,1638 30 AVENUE SW,T2T1P4,2004-04-15 00:00:00
1,Lakeview Baptist Church of Calgary Society,Charitable Organization,808874432RR0001,Christianity,Baptist,3,100,CALGARY,WWW.LAKEVIEWBC.CA,LAKEVIEW BAPTIST CHURCH OF CALGARY SOCIETY,5336 LAKEVIEW DRIVE S.W.,T3E5R9,1967-01-01 00:00:00
1,MOUNT ZION CHRISTIAN FELLOWSHIP,Charitable Organization,894364363RR0001,Christianity,Other,3,100,CALGARY,"",MOUNT ZION CHRISTIAN FELLOWSHIP,365 BRIGHTONSTONE GREEN SE,T2Z0H1,1995-05-02 00:00:00
1,MOUNTAIN OF FIRE AND MIRACLES MINISTRIES (A CHRISTIAN ORGANIZATION),Charitable Organization,884819707RR0001,Christianity,Other,3,100,CALGARY,WWW.MFMCALGARY.ORG,MOUNTAIN OF FIRE AND MIRACLES MINISTRIES (A CHRISTIAN ORGANIZATION),8103-48 AVENUE NW,T3B2A8,2003-03-05 00:00:00
1,Nadia's Hope Foundation,Private Foundation,789892130RR0001,Support of schools and education,Other,3,100,CALGARY,www.nadiashopefoundation.com,NADIA'S HOPE FOUNDATION,305 - 1015 14 AVE SW,T2R0N9,2020-02-28 00:00:00
1,"New Covenant Assembly, Calgary",Charitable Organization,841260235RR0001,Christianity,Other,3,100,CALGARY,WWW.NEWCOVENANTASSEMBLY.CA,"NEW COVENANT ASSEMBLY, CALGARY",541 WINDRIDGE ROAD SOUTHWEST,T4B2P9,2013-08-19 00:00:00
1,Prairie Crocus Foundation,Private Foundation,724235916RR0001,Foundations,Foundations funding community benefit QDs in general,3,103,CALGARY,"",PRAIRIE CROCUS FOUNDATION,1900 - 520 3 AVE SW,T2P0R3,2019-01-01 00:00:00
1,PROSPECT HUMAN SERVICES SOCIETY,Charitable Organization,106831290RR0001,Teaching Institutions,Other,3,100,CALGARY,WWW.PROSPECTNOW.CA,PROSPECT HUMAN SERVICES SOCIETY,915 33 ST NE,T2A6T2,1988-04-21 00:00:00
1,PTARMIGAN CHARITABLE FOUNDATION,Private Foundation,875849192RR0001,Foundations,Foundations funding community benefit QDs in general,3,65,CALGARY,"",PTARMIGAN CHARITABLE FOUNDATION,7 CLEAR MOUNTAIN RISE SW,T3Z3J9,1997-10-07 00:00:00
1,"Redeemed Christian Church of God, Open Heavens Parish Calgary",Private Foundation,801328766RR0001,Christianity,Other,3,100,CALGARY,WWW.RCCGOPENHEAVENS.CA,"REDEEMED CHRISTIAN CHURCH OF GOD, OPEN HEAVENS PARISH CALGARY",18 SAGE BLUFF HTS NW,T3R1T3,2016-01-01 00:00:00
1,RUSSIAN GREEK ORTHODOX CHURCH OF ALL SAINTS,Charitable Organization,107944860RR0001,Christianity,Other,3,100,CALGARY,"",RUSSIAN GREEK ORTHODOX CHURCH OF ALL SAINTS,905-8TH AVE N E,T2E0S2,1967-01-01 00:00:00
1,SKYVIEW COMMUNITY CHURCH OF THE NAZARENE,Charitable Organization,895950434RR0001,Christianity,Other,3,100,CALGARY,WWW.SKYVIEWCHURCH.CA,SKYVIEW COMMUNITY CHURCH OF THE NAZARENE,9685 HARVEST HILLS BLVD NW,T3K2M3,1967-01-01 00:00:00
1,Southern Alberta Myeloma Patient Society,Public Foundation,846124907RR0001,Foundations,Foundations for specified community benefit,3,100,CALGARY,WWW.SAMPS.CA,Southern Alberta Myeloma Patient Society,PO BOX 8165 STATION A,T2H0H7,2012-03-16 00:00:00
1,ST. BARNABAS ANGLICAN CHURCH,Charitable Organization,119168870RR0001,Christianity,Anglican,3,95,CALGARY,WWW.STBARNABAS.CA,ST BARNABAS ANGLICAN CHURCH,1407 7 AVE NW,T2N0Z3,1967-01-01 00:00:00
1,ST. GEORGE'S ANGLICAN CHURCH,Charitable Organization,108018847RR0001,Christianity,Anglican,3,99,CALGARY,WWW.STGEORGESCALGARY.COM,ST. GEORGE'S ANGLICAN CHURCH,2523 56 STREET NE,T1Y6E7,1978-02-20 00:00:00
1,"St. John the Evangelist, Calgary Catholic Congregation, Inc.",Charitable Organization,811073139RR0001,Christianity,Catholic,3,100,CALGARY,STJOHNSCALGARY.NET,"ST. JOHN THE EVANGELIST, CALGARY CATHOLIC CONGREGATION, INC.",1423 8TH AVENUE SOUTHEAST,T2G0N1,2015-02-05 00:00:00
1,St. Stephen's Church,Charitable Organization,107950115RR0001,Christianity,Anglican,3,95,CALGARY,WWW.STSTEPHENSCALGARY.ORG,SAINT STEPHEN'S CHURCH,1121 14TH AVE SW,T2R0P3,1967-01-01 00:00:00
1,STROKE RECOVERY ASSOCIATION OF CALGARY,Charitable Organization,132014291RR0001,Core Health Care,Other,3,90,CALGARY,WWW.SRACALGARY.COM,STROKE RECOVERY ASSOCIATION OF CALGARY,PO BOX 5051 STATION A,T2H1X1,1990-01-01 00:00:00
1,THE BRENDA STRAFFORD FOUNDATION LTD.,Charitable Organization,105198873RR0001,Core Health Care,Hospitals (diagnosing and treating health conditions),3,94,CALGARY,THEBSF.CA,THE BRENDA STRAFFORD FOUNDATION LTD.,4628 MONTGOMERY BLVD NW,T3B0K7,1975-08-15 00:00:00
1,The Exchange of The Christian and Missionary Alliance in Canada,Charitable Organization,724233515RR0001,Christianity,Other,3,100,CALGARY,"",The Exchange of The Christian and Missionary Alliance in Canada,131 - 10550 42 ST SE,T2C5C7,2019-07-01 00:00:00
1,THE PRAIRIE JOURNAL TRUST,Charitable Organization,119251726RR0001,Educational organizations not elsewhere categorized,Other,3,90,CALGARY,"",THE PRAIRIE JOURNAL TRUST,"28 CROWFOOT TERRACE NW, P.O. BOX 68073",T3G3N8,1983-08-13 00:00:00
1,"The Redeemed Christian Church of God (Living Faith Chapel), Calgary",Charitable Organization,831755707RR0001,Christianity,Other,3,100,CALGARY,WWW.RCCGLFC.ORG,"THE REDEEMED CHRISTIAN CHURCH OF GOD (LIVING FAITH CHAPEL), CALGARY",133 PANATELLA SQ NW,T3K6C7,2014-11-07 00:00:00
1,"The Redeemed Christian Church of God, Jesus Palace, Calgary",Charitable Organization,752157511RR0001,Christianity,Other,3,100,CALGARY,"","THE REDEEMED CHRISTIAN CHURCH OF GOD, JESUS PALACE, CALGARY",968 COPPERFIELD BLVD SE,T2Z4W7,2018-05-02 00:00:00
1,The Redeemed Christian Church of God-Victory House Calgary,Charitable Organization,772913091RR0001,Christianity,Other,3,100,CALGARY,"",The Redeemed Christian Church of God-Victory House Calgary,215 PANAMOUNT GDNS NW,T3K5V3,2016-03-18 00:00:00
1,The Sinneave Family Foundation,Charitable Organization,805222759RR0001,Foundations,Foundations for specified community benefit,3,100,CALGARY,WWW.SINNEAVEFOUNDATION.ORG,THE SINNEAVE FAMILY FOUNDATION,"300, 3820 24TH AVE NW",T3B2X9,2008-03-27 00:00:00
1,THE WAY CHRISTIAN MISSION FELLOWSHIP ALBERTA,Charitable Organization,894828110RR0001,Christianity,Other,3,100,CALGARY,"",THE WAY CHRISTIAN MISSION FELLOWSHIP ALBERTA,303 4909-17 AVE SE,T2A0V5,2001-03-09 00:00:00
1,UNITED YOUTH OUTREACH,Charitable Organization,860028687RR0001,Support of Religion,Other,3,100,CALGARY,WWW.UNITEDYOUTHOUTREACH.CA,UNITED YOUTH OUTREACH,8 3530 11A STREET NE,T2E6M7,2002-11-25 00:00:00
1,VEDANTA SOCIETY OF CALGARY,Charitable Organization,119261345RR0001,Christianity,Other,3,,CALGARY,WWW.VEDANTACALGARY.COM,VEDANTA SOCIETY OF CALGARY,160 226 AVE SW,T2X1K4,1973-05-10 00:00:00
1,WESTSIDE CALGARY CHINESE ALLIANCE CHURCH,Charitable Organization,139094080RR0001,Christianity,Other,3,99,CALGARY,WWW.WCCAC.NET,WESTSIDE CALGARY CHINESE ALLIANCE CHURCH,6600 COUNTRY HILLS BLVD NW,T3G4H4,1994-03-24 00:00:00
1,WOMEN'S CENTRE OF CALGARY,Charitable Organization,874914955RR0001,Community Resource,Other,3,100,CALGARY,WWW.WOMENSCENTRECALGARY.ORG,WOMEN'S CENTRE OF CALGARY,39 4 ST NE,T2E3R6,2000-07-19 00:00:00
1,WORLD-WIDE MISSIONS SOCIETY OF BRITISH COLUMBIA,Charitable Organization,133098368RR0001,Support of Religion,Mission / Missionary organization,3,100,CALGARY,"",WORLD - WIDE MISSIONS SOCIETY OF BRITISH COLUMBIA,PO BOX 11,T2P2G9,1975-01-01 00:00:00
1,ALBERTA BALLET COMPANY,Charitable Organization,118780378RR0001,Public Amenities,Camps / recreation,2,100,CALGARY,WWW.ALBERTABALLET.COM,ALBERTA BALLET COMPANY,141 18 AVE SW,T2S0B8,1979-01-01 00:00:00
1,BRAHMA KUMARIS WORLD SPIRITUAL ORGANIZATION - A SOCIETY FOR WORLD DEVELOPMENT,Charitable Organization,891638520RR0001,Christianity,Other,2,100,CALGARY,WWW.BKCALGARY.ORG,BRAHMA KUMARIS WORLD SPIRITUAL ORGANIZATION - A SOCIETY FOR WORLD DEVELOPMENT,104 - 1312 RUSSELL RD NE,T2E5N3,2001-01-01 00:00:00
1,Calgary Grace and Truth Church,Charitable Organization,848505293RR0001,Christianity,Other,2,100,CALGARY,SITES.GOOGLE.COM/SITE/CALGARYGRACEANDTRUTHCHURCH,Calgary Grace And Truth Church,26 SILVERADO SKIES MANOR SW,T2X0K3,2008-07-04 00:00:00
1,CALGARY KASOTA CAMP SOCIETY,Charitable Organization,118823699RR0001,Support of Religion,Other,2,80,CALGARY,WWW.CAMPKASOTAWEST.COM,CALGARY KASOTA CAMP SOCIETY,3623 2ND ST NW,T2K0Y3,1980-01-01 00:00:00
1,CALGARY MULTICULTURAL CHOIR SOCIETY,Charitable Organization,891252546RR0001,Arts,Other,2,,WESTBROOK CALGARY,WWW.CALGARYMULTICULTURALCHOIR.CA,CALGARY MULTICULTURAL CHOIR SOCIETY,PO BOX 34072 RPO,T3C3W2,1992-08-04 00:00:00
1,CHRIST MORAVIAN COMMUNITY CHURCH,Charitable Organization,118858562RR0001,Christianity,Other,2,100,CALGARY,WWW.CHRISTMORAVIAN.COM,CHRIST MORAVIAN COMMUNITY CHURCH,600 ACADIA DRIVE SE,T2J0B8,1967-01-01 00:00:00
1,CORNERSTONE BAPTIST CHURCH OF CALGARY,Charitable Organization,890613995RR0001,Christianity,Baptist,2,100,CALGARY,"",CORNERSTONE BAPTIST CHURCH OF CALGARY,2624 56 ST NE,T1Y2E7,1993-01-01 00:00:00
1,EPILEPSY ASSOCIATION OF CALGARY,Charitable Organization,118900778RR0001,Core Health Care,Other,2,100,CALGARY,EPILEPSYCALGARY.COM,EPILEPSY ASSOCIATION OF CALGARY,316 - 4014 MACLEOD TRAIL SE,T2G2R7,1967-01-01 00:00:00
1,Freedom Tree,Charitable Organization,839381688RR0001,Educational organizations not elsewhere categorized,Other,2,100,CALGARY,www.freedomtree.ca,FREEDOM TREE,2830 39 STREET SW,T3E3G7,2012-09-24 00:00:00
1,GREEN CALGARY ASSOCIATION,Charitable Organization,885359158RR0001,Community Resource,Other,2,100,CALGARY,WWW.GREENCALGARY.ORG,GREEN CALGARY ASSOCIATION,100 301 14TH ST. NW,T2N2A1,1986-01-01 00:00:00
1,LIGHT UP THE WORLD,Charitable Organization,890802176RR0001,Foundations,Foundations funding community benefit QDs in general,2,100,CALGARY,WWW.LUTW.ORG,LIGHT UP THE WORLD,PO BOX 16039 RPO LOWER,T2T5H7,1994-11-25 00:00:00
1,RIVER VIEW CHRISTIAN CHURCH OF CALGARY,Charitable Organization,119157725RR0001,Christianity,Other,2,100,CALGARY,"",RIVER VIEW CHRISTIAN CHURCH OF CALGARY,1911-76 AVE SE,T2C0G8,1968-01-01 00:00:00
1,"SOCIETY OF ST VINCENT DE PAUL, CORPUS CHRISTI CONFERENCE, CALGARY",Charitable Organization,132410671RR0184,Organizations Relieving Poverty,Other,2,100,CALGARY,"",Société de Saint-Vincent de Paul-Conseil national du Canada Society of Saint-Vincent de Paul-National council of Canada,404 NORTHMOUNT PLACE NW,T2K3P9,1993-02-08 00:00:00
1,SOCIETY OF ST VINCENT DE PAUL-ST GERARD'S CONFERENCE,Charitable Organization,132410671RR0129,Organizations Relieving Poverty,Other,2,100,CALGARY,N/A,Société de Saint-Vincent de Paul-Conseil national du Canada Society of Saint-Vincent de Paul-National council of Canada,8944 ELBOW DR. SW,T2V1L2,1990-01-01 00:00:00
1,THE CHINESE ACADEMY FOUNDATION,Charitable Organization,887333631RR0001,Teaching Institutions,Other,2,,CALGARY,WWW.CHINESEACADEMY.CA,THE CHINESE ACADEMY FOUNDATION,191 - 1518 CENTRE ST NE,T2E2R9,2004-10-01 00:00:00
1,THE EBENEZER PRESBYTERIAN CHURCH OF CALGARY,Charitable Organization,849757125RR0001,Christianity,Presbyterian,2,100,CALGARY,WWW.CEPC.KR,THE EBENEZER PRESBYTERIAN CHURCH OF CALGARY,75 HAMPTONS HTS NW,T3A5W1,2006-08-05 00:00:00
1,THE HELLENIC GREEK ORTHODOX COMMUNITY OF CALGARY AND DISTRICT,Charitable Organization,132014861RR0001,Christianity,Other,2,100,CALGARY,WWW.CALGARYHELLENIC.COM,HELLENIC GREEK ORTHODOX COMMUNITY OF CALGARY & DISTRICT,1 TAMARAC CR. S.W.,T3C3B7,1967-01-01 00:00:00
1,The Milne Charitable Foundation,Private Foundation,708719521RR0001,Foundations,Foundations funding community benefit QDs in general,2,100,CALGARY,"",THE MILNE CHARITABLE FOUNDATION,9 ELMONT VIEW SW,T3H0K5,2017-06-15 00:00:00
1,THE MINDFUEL FOUNDATION,Charitable Organization,132657065RR0001,Foundations Advancing Education,Foundations funding educational QDs in general,2,100,CALGARY,MINDFUEL.CA,THE MINDFUEL FOUNDATION,"260, 3512-33 STREET NW",T2L2A6,1990-01-26 00:00:00
1,THE WEASELHEAD/GLENMORE PARK PRESERVATION SOCIETY,Charitable Organization,881547491RR0001,Environment,Conservation of nature / habitat group / ecosystem preservation etc.,2,100,CALGARY,WWW.THEWEASELHEAD.COM,THE WEASELHEAD/GLENMORE PARK PRESERVATION SOCIETY,PO BOX 36032 RPO LAKEVIEW,T3E7C6,2005-07-01 00:00:00
1,THREE LEFT FEET MOVEMENT CREATIONS,Charitable Organization,867083859RR0001,Educational organizations not elsewhere categorized,Other,2,100,CALGARY,WWW.THREELEFTFEET.CA,THREE LEFT FEET MOVEMENT CREATIONS,2 - 1709 8 AVE NE,T2E0S9,1998-01-01 00:00:00
1,TRUE JESUS CHURCH IN CALGARY,Charitable Organization,889003455RR0001,Christianity,Other,2,100,CALGARY,"",TRUE JESUS CHURCH IN CALGARY,232 8A ST NE,T2E4J1,1995-04-01 00:00:00
1,Abundant Life Chinese Baptist Church,Charitable Organization,835050840RR0001,Christianity,Other,1,100,CALGARY,WWW.ABUNDANTLIFECBC.ORG,ABUNDANT LIFE CHINESE BAPTIST CHURCH,103 CANTERBURY CRT SW,T2W6B9,2012-11-01 00:00:00
1,Accessibility Renovations for Kids (ARK) Society,Charitable Organization,787024686RR0001,Organizations Relieving Poverty,Providing material assistance (clothing / computers / equipment),1,100,CALGARY,WWW.ARKSOCIETY.CA,ACCESSIBILITY RENOVATIONS FOR KIDS (ARK) SOCIETY,26 SILVERADO SKIES CRES SW,T2X0J5,2017-10-04 00:00:00
1,ALL SAINTS LUTHERAN CHURCH,Charitable Organization,891027989RR0001,Christianity,Protestant,1,100,CALGARY,WWW.ALLSAINTSLUTHERANCHURCH.CA,"ALL SAINTS LUTHERAN CHURCH, CALGARY, ALBERTA",380 MIDPARK BLVD SE,T2X2K4,1981-04-20 00:00:00
1,ARCTIC INSTITUTE OF NORTH AMERICA,Charitable Organization,118789254RR0001,Public Amenities,Heritage / Historical site,1,100,CALGARY,WWW.ARCTIC.UCALGARY.CA,THE ARCTIC INSTITUTE OF NORTH AMERICA,"C-O UNIVERSITY OF CALGARY, 2500 UNIVERSITY DR NW",T2N1N4,1967-01-01 00:00:00
1,Ark of Christ Victory Church of Calgary,Charitable Organization,758427728RR0001,Christianity,Other,1,100,CALGARY,WWW.ARKOFCHRIST.CA,ARK OF CHRIST VICTORY CHURCH OF CALGARY,3663 19 ST NE,T2E6S8,2017-01-01 00:00:00
1,"Bethel Methodist Church, Calgary",Charitable Organization,708588892RR0001,Christianity,Other,1,100,CALGARY,"","Bethel Methodist Church, Calgary","3545 - 32 ND AVENUE NE, BOX 652",T1Y6M6,2014-01-01 00:00:00
1,Butterfly Effect Microcredit Foundation,Public Foundation,807415294RR0001,Foundations,Foundations funding community benefit QDs in general,1,100,CALGARY,"",Butterfly Effect Microcredit Foundation,320 - 1010 8 AVE SW,T2P1J2,2009-04-30 00:00:00
1,CALGARY BIRD BANDING SOCIETY,Charitable Organization,898874573RR0001,Animal Welfare,Wildlife protection organization,1,100,CALGARY,WWW. CALGARYBIRDBANDINGSOCIETY.ORG,CALGARY BIRD BANDING SOCIETY,PO BOX 36111 RPO LAKEVIEW,T3E7C6,1999-03-01 00:00:00
