1,SOUTHERN ALBERTA INSTITUTE OF TECHNOLOGY,Charitable Organization,107995789RR0001,Teaching Institutions,Other,,,CALGARY,WWW.SAIT.CA,SOUTHERN ALBERTA INSTITUTE OF TECHNOLOGY,1301 16 AVE NW,T2M0L4,1983-07-01 00:00:00
1,SOUTHERN ALBERTA PIONEERS' FOUNDATION,Charitable Organization,119157410RR0001,Public Amenities,Other,,,CALGARY,PIONEERSALBERTA.ORG,SOUTHERN ALBERTA PIONEERS' FOUNDATION,3625 4 STREET SW,T2S1Y3,1984-12-04 00:00:00
1,SOUTHERN ALBERTA ROTTWEILER RESCUE SOCIETY,Private Foundation,859277287RR0001,Animal Welfare,Animal shelter / neuter /adoption,,,CALGARY,www.albertarottweilers.com,SOUTHERN ALBERTA ROTTWEILER RESCUE SOCIETY,203 RIVERWOOD CIRCLE SE,T2C4A8,2003-02-19 00:00:00
1,Southern Alberta Sports Equipment Bank Society,Charitable Organization,841004583RR0001,Organizations Relieving Poverty,Other,,,CALGARY,"",SOUTHERN ALBERTA SPORTS EQUIPMENT BANK SOCIETY,3557 52 ST SE,T2B3R3,2016-01-06 00:00:00
1,SOUTHSIDE VICTORY CHURCH FELLOWSHIP,Charitable Organization,826341877RR0001,Christianity,Other,,,CALGARY,WWW.SOUTHSIDEVICTORY.CA,SOUTHSIDE VICTORY CHURCH FELLOWSHIP,6402 1A STREET SW,T2H0G6,1995-10-02 00:00:00
1,SOUTHVIEW ALLIANCE CHURCH,Charitable Organization,119158699RR0001,Christianity,Other,,,CALGARY,"",SOUTHVIEW ALLIANCE CHURCH,20200 WALDEN BLVD SE,T2X0N4,1979-10-04 00:00:00
1,SOUTHWEST CALGARY PAVILION OF HOPE CHURCH,Charitable Organization,869443754RR0001,Christianity,Other,,,CALGARY,"",SOUTHWEST CALGARY PAVILION OF HOPE CHURCH,232 WILLOW PARK DR SE,T2J0K5,1999-01-29 00:00:00
1,"Southwinds Baptist Church, Calgary",Charitable Organization,853781318RR0001,Christianity,Baptist,,,CALGARY,SOUTHWINDSCHURCH.CA,"Southwinds Baptist Church, Calgary",210 - 240 MIDPARK WAY SE,T2X1N4,2011-01-23 00:00:00
1,SOUTHWOOD CHURCH OF GOD,Charitable Organization,119158947RR0001,Christianity,Pentecostal,,,CALGARY,"",SOUTHWOOD CHURCH OF GOD,"112 OAKMOUNT ROAD, S.W.",T2V4X4,1986-11-23 00:00:00
1,"SOUTHWOOD UNITED CHURCH,",Charitable Organization,131816506RR0001,Christianity,United,,,CALGARY,WWW.SOUTHWOODCHURCH.CA,SOUTHWOOD UNITED CHURCH,10690 ELBOW DR S.W.,T2W1G4,1967-01-01 00:00:00
1,SPANISH CHRISTIAN FELLOWSHIP,Charitable Organization,140591694RR0001,Christianity,Other,,,CALGARY,"",SPANISH CHRISTIAN FELLOWSHIP,3125 CATALINA BLVD NE,T1Y6R1,1993-03-04 00:00:00
1,Spanish Circuit 3A of Jehovah's Witnesses,Charitable Organization,766250682RR0001,Christianity,Jehovahs Witnesses,,,CALGARY,"",Spanish Circuit 3A of Jehovah's Witnesses,115 CEDARGROVE WAY SW,T2W4V1,1993-01-01 00:00:00
1,Spanish Pentecostal Church of Calgary,Charitable Organization,806494712RR0001,Christianity,Other,,,CALGARY,"",Spanish Pentecostal Church of Calgary,208 ABINGER CRESCENT N.E.,T2A6L3,2012-02-06 00:00:00
1,SPE Canadian Educational Foundation,Charitable Organization,800632549RR0001,Support of schools and education,Other,,,CALGARY,"",SPE Canadian Educational Foundation,1410 - 715 5 AVE SW,T2P2X6,2015-12-09 00:00:00
1,SPINA BIFIDA AND HYDROCEPHALUS ASSOCIATION OF SOUTHERN ALBERTA,Charitable Organization,119159481RR0001,Organizations Relieving Poverty,Other,,,CALGARY,WWW.SBHASA.CA,SPINA BIFIDA AND HYDROCEPHALUS ASSOCIATION OF SOUTHERN ALBERTA,PO BOX 6837 STATION D,T2P2E9,1981-03-01 00:00:00
1,SPIRITUS CHAMBER CHOIR AND PERFORMING ARTS ENSEMBLE SOCIETY,Charitable Organization,875727513RR0001,Education in the arts,Music conservatory / school / society,,,CALGARY,WWW.SPIRITUSCHAMBERCHOIR.CA,SPIRITUS CHAMBER CHOIR AND PERFORMING ARTS ENSEMBLE SOCIETY,1315 7 ST SW,T2R1A5,2001-10-16 00:00:00
1,SPIRITUS MARCHING ARTS ASSOCIATION,Charitable Organization,846847911RR0001,Education in the arts,Theatre / film / drama school / society / company,,,CALGARY,"",SPIRITUS MARCHING ARTS ASSOCIATION,58 - 28 BERWICK CRES NW,T3K1Y7,2011-05-26 00:00:00
1,Springbank Chinese Baptist Church,Charitable Organization,825613383RR0001,Christianity,Baptist,,,CALGARY,WWW.SPRINGBANKCHURCH.ORG,SPRINGBANK CHINESE BAPTIST CHURCH,119 LEIGHTON LANE,T3Z0A2,2014-10-02 00:00:00
1,"Springbank Congregation of Jehovah's Witnesses, Calgary, Alberta",Charitable Organization,764956488RR0001,Christianity,Jehovahs Witnesses,,,CALGARY,"","Springbank Congregation of Jehovah's Witnesses, Calgary, Alberta",31 WESTON MANOR SW,T3H5E7,1967-01-01 00:00:00
1,SPRINGBANK PARK FOR ALL SEASONS AGRICULTURAL SOCIETY,Charitable Organization,123275224RR0001,Public Amenities,Camps / recreation,,,CALGARY,"",SPRINGBANK PARK FOR ALL SEASONS AGRICULTURAL SOCIETY,32224A SPRINGBANK ROAD,T3Z2L9,1996-07-01 00:00:00
1,SPRINGBANK UNITED CHURCH,Charitable Organization,134175520RR0001,Christianity,United,,,CALGARY,WWW.SPRINGBANKUNITED.ORG,SPRINGBANK UNITED CHURCH,250011 RANGE ROAD 33,T3Z1L2,1989-03-04 00:00:00
1,SPRINGBOARD CENTRE FOR ADULTS WITH DISABILITIES,Charitable Organization,107560443RR0001,Teaching Institutions,Other,,,CALGARY,WWW.SPRINGBOARDCENTRE.CA,SPRINGBOARD CENTRE FOR ADULTS WITH DISABILITIES,"STE 14, 2115 27TH AVE NE",T2E7E4,1987-08-26 00:00:00
1,SPRINGBOARD DANCE COLLECTIVE CALGARY SOCIETY,Charitable Organization,888267242RR0001,Education in the arts,Theatre / film / drama school / society / company,,,CALGARY,WWW.SPRINGBOARDPERFORMANCE.COM,SPRINGBOARD PERFORMANCE SOCIETY,"205 8TH AVE SE, 2ND FLOOR",T2G0K9,1996-03-02 00:00:00
1,Spruce Meadows Leg Up Foundation,Public Foundation,821683364RR0001,Foundations,Foundations funding community benefit QDs in general,,,CALGARY,"",SPRUCE MEADOWS LEG UP FOUNDATION,18011 SPRUCE MEADOWS SW,T2X4B7,2015-05-22 00:00:00
1,Sri Anagha Datta Society of Calgary,Charitable Organization,833038615RR0001,Other Religions,Hinduism,,,CALGARY,WWW.ANAGHADATTA.ORG,SRI ANAGHA DATTA SOCIETY OF CALGARY,167 SIERRA VISTA CIRCLE SW,T3H3A4,2008-12-19 00:00:00
1,SRI SATHYA SAI FOUNDATION OF CALGARY,Charitable Organization,887910362RR0001,Support of Religion,Other,,,CALGARY,www.sathyasaicalgary.org,SRI SATHYA SAI FOUNDATION OF CALGARY,131 HIDDEN RANCH CIR NW,T3A5P6,1998-08-24 00:00:00
1,SRILANKAN BUDDHIST SOCIETY - CALGARY,Charitable Organization,879274652RR0001,Other Religions,Buddhism,,,CALGARY,WWW.EHIPASSIKO-CALGARY.ORG,SRILANKAN BUDDHIST SOCIETY - CALGARY,15150 PARK LANE,T3P1A6,2002-12-16 00:00:00
1,ST ANDREW'S ANGLICAN CHURCH,Charitable Organization,129209680RR0001,Christianity,Anglican,,,CALGARY,ST-ANDREWS-ANGLICAN-CALGARY.CA,ST ANDREW'S ANGLICAN CHURCH,1611 ST. ANDREW'S PLACE N.W.,T2N3Y4,1967-01-01 00:00:00
1,ST AUGUSTINE EDUCATIONAL SOCIETY,Charitable Organization,120969175RR0001,Support of schools and education,Other,,,CALGARY,"",ST AUGUSTINE EDUCATIONAL SOCIETY,7112-7 STREET S.W.,T2V1E9,1987-09-17 00:00:00
1,ST BONAVENTURE JUNIOR HIGH EDUCATIONAL SOCIETY,Charitable Organization,890569346RR0001,Support of schools and education,Other,,,CALGARY,"",ST BONAVENTURE JUNIOR HIGH EDUCATIONAL SOCIETY,1710 ACADIA DRIVE SE,T2J3X8,1990-07-05 00:00:00
1,ST DAVID'S UNITED CHURCH FOUNDATION OF CALGARY,Public Foundation,890918865RR0001,Foundations Advancing Religions,Foundations for specified religious charities,,,CALGARY,"",ST DAVID'S UNITED CHURCH FOUNDATION OF CALGARY,3303 CAPITOL HILL CRES N.W.,T2M2R2,1992-07-07 00:00:00
1,ST EDMUND K AND M ANGLICAN CHURCH,Charitable Organization,133638809RR0001,Christianity,Anglican,,,CALGARY,"",ST EDMUND K AND M ANGLICAN CHURCH,8336 34 AVE NW,T3B1R2,1967-01-01 00:00:00
1,ST FRANCIS MUSIC SOCIETY,Charitable Organization,877015271RR0001,Education in the arts,Other,,,CALGARY,WWW.SAINTFRANCISMUSIC.COM,ST FRANCIS MUSIC SOCIETY,877 NORTHMOUNT DRIVE,T2L0A3,1996-01-01 00:00:00
1,ST GERARD EDUCATIONAL SOCIETY,Charitable Organization,136861879RR0001,Support of schools and education,Other,,,CALGARY,"",ST GERARD EDUCATIONAL SOCIETY,1204 96 AVENUE SW,T2V0Y1,1993-01-01 00:00:00
1,ST GERMAIN FOUNDATION OF CANADA,Private Foundation,892901562RR0001,Support of Religion,Other,,,CALGARY,"",ST GERMAIN FOUNDATION OF CANADA,2804 PARKDALE BLVD. NW.,T2N3S8,1967-01-01 00:00:00
1,ST JAMES EDUCATION SOCIETY OF CALGARY,Charitable Organization,892207044RR0001,Support of schools and education,Other,,,CALGARY,SYDELLEHURLEY@SHAW.CA,ST JAMES EDUCATION SOCIETY OF CALGARY,2227 58 AVE SW,T3E1N6,1988-07-04 00:00:00
1,ST JOHN CONFERENCE IN CA,Charitable Organization,132410671RR0190,Organizations Relieving Poverty,Other,,,CALGARY,"",Société de Saint-Vincent de Paul-Conseil national du Canada Society of Saint-Vincent de Paul-National council of Canada,215 VALLEY POINTE PL NW,T3B6B2,1996-06-03 00:00:00
1,ST LUKE'S CHURCH,Charitable Organization,132946278RR0001,Christianity,Anglican,,,CALGARY,WWW.STLUKESCHURCH.ORG,ST LUKE'S ANGLICAN CHURCH,2951 26 AVE SE,T2B2P2,1967-01-01 00:00:00
1,ST MARY'S FRATERNITY SECULAR FRANCISCAN ORDER,Charitable Organization,119188993RR0001,Support of Religion,Convents and Monasteries,,,CALGARY,"",ST MARY'S FRATERNITY SECULAR FRANCISCAN ORDER,92 CRAMOND GREEN SE,T3M1J9,1979-01-01 00:00:00
1,ST MATTHEW'S UNITED CHURCH,Charitable Organization,119190767RR0001,Christianity,United,,,CALGARY,ST-MATTHEWS-UC.ORG,ST MATTHEW'S UNITED CHURCH,2035-26A ST S W,T3E2B9,1967-01-01 00:00:00
1,ST MICHAEL SCHOOL COUNCIL ASSOCIATION,Charitable Organization,873768279RR0001,Support of schools and education,Other,,,CALGARY,WWW.CSSD.AB.CA/SCHOOLS/STMICHAEL/PARENTS/SCHOOLCOUNCIL,ST MICHAEL SCHOOL COUNCIL ASSOCIATION,4511 8TH AVE SW,T3C0G9,1993-07-23 00:00:00
1,ST PAUL'S ANGLICAN CHURCH,Charitable Organization,119194298RR0001,Christianity,Anglican,,,CALGARY,WWW.STPAULSCALGARY.CA,ST PAUL'S ANGLICAN CHURCH,7 SUNMILLS GREEN SE,T2X3P6,1967-01-01 00:00:00
1,ST PETER THE ALEUT ORTHODOX CHRISTIAN CHURCH,Charitable Organization,134770387RR0001,Christianity,Other,,,CALGARY,holymartyrpeter.ca,ST PETER THE ALEUT ORTHODOX CHRISTIAN CHURCH,1802 33 AVE SW,T2T1Y9,1992-01-01 00:00:00
1,ST PETERS CHARITABLE FOUNDATION,Public Foundation,887701662RR0001,Foundations Advancing Religions,Foundations funding religious QDs in general,,,CALGARY,"",ST PETERS CHARITABLE FOUNDATION,903 75TH AVE. S.W.,T2V0S7,1988-07-19 00:00:00
1,ST PHILIP EDUCATION SOCIETY,Charitable Organization,888718285RR0001,Support of schools and education,School councils (parent-teacher associations),,,CALGARY,CSSD.AB.CA/ST.PHILIP,ST PHILIP EDUCATION SOCIETY,13825 PARKSIDE DR SE,T2J5A8,1997-05-20 00:00:00
1,"ST THOMAS MAR THOMA CHURCH, CALGARY",Charitable Organization,890032642RR0001,Christianity,Other,,,CALGARY,WWW.CALGARYMARTHOMACHURCH.COM,"St.Thomas Mar Thoma Church, Calgary",117 - 3825 34 ST NE,T1Y6Z8,1989-09-08 00:00:00
1,ST THOMAS UNITED CHURCH,Charitable Organization,119203412RR0001,Christianity,United,,,CALGARY,STTHOMASUNITED.CA,ST THOMAS UNITED CHURCH,100 HAWKWOOD BLVD N.W.,T3G2S9,1976-06-29 00:00:00
1,ST VINCENT DE PAUL SCHOOL EDUCATIONAL SOCIETY,Charitable Organization,888962578RR0001,Support of schools and education,Other,,,CALGARY,"",ST VINCENT DE PAUL SCHOOL EDUCATIONAL SOCIETY,4525-49TH STREET N.W.,T3A0K4,1995-07-01 00:00:00
1,ST VINCENT DE PAUL SOCIETY ST MICHAEL'S CONFERENCE,Charitable Organization,132410671RR0284,Organizations Relieving Poverty,Other,,,CALGARY,WWW.SNTMICHAEL.COM,Société de Saint-Vincent de Paul-Conseil national du Canada Society of Saint-Vincent de Paul-National council of Canada,800 - 85 STREET WEST,T3H4C7,1998-01-22 00:00:00
1,ST. ALBERT THE GREAT CATHOLIC PARISH,Charitable Organization,107909939RR0084,Christianity,Catholic,,,CALGARY,"",RC DIOCESE OF CALGARY,10 PRESTWICK DR SE.,T2Z4J6,1998-08-01 00:00:00
1,ST. ANDREW EDUCATIONAL SOCIETY,Charitable Organization,895642460RR0001,Support of schools and education,Other,,,CALGARY,"",ST ANDREW EDUCATIONAL SOCIETY,4331 41 AVE SW,T3E1G2,1996-08-01 00:00:00
1,ST. ANDREW'S UNITED CHURCH,Charitable Organization,108006388RR0001,Christianity,United,,,CALGARY,www.andychurch.org,ST. ANDREW'S UNITED CHURCH,"1, 10601 SOUTHPORT RD. SW",T2W3M6,1967-01-01 00:00:00
1,ST. ANNE'S KOREAN CATHOLIC PARISH,Charitable Organization,107909939RR0086,Christianity,Catholic,,,CALGARY,"",RC DIOCESE OF CALGARY,910 - 21 AVENUE SE,T2G1N1,2004-02-02 00:00:00
1,ST. ANTHONY'S CHURCH,Charitable Organization,107909939RR0017,Christianity,Catholic,,,CALGARY,WWW.STANTHONYSCALGARY.COM,RC DIOCESE OF CALGARY,5340 - 4TH STREET SW,T2V0Z5,1967-01-01 00:00:00
1,ST. AUGUSTINE'S CHURCH,Charitable Organization,119168599RR0001,Christianity,Anglican,,,CALGARY,WWW.STAUGCALGARY.CA,ST AUGUSTINE'S ANGLICAN CHURCH,7602 22A ST SE,T2C0X5,1967-01-01 00:00:00
1,St. Basil's Melkite Greek Catholic Church,Charitable Organization,107909939RR0094,Christianity,Catholic,,,CALGARY,"",RC DIOCESE OF CALGARY,120 17 AVE SW,T2S2T2,2015-12-10 00:00:00
1,ST. BERNADETTE'S CHURCH,Charitable Organization,107909939RR0023,Christianity,Catholic,,,CALGARY,SLBERNADETTE@SHAW.CA,RC DIOCESE OF CALGARY,7103-20A STREET SE,T2C0R6,1992-11-21 00:00:00
1,ST. BERNARD ROMAN CATHOLIC PARISH,Charitable Organization,107909939RR0059,Christianity,Catholic,,,CALGARY,"",RC DIOCESE OF CALGARY,7624-39 AVE NW,T3B1X3,1967-01-01 00:00:00
1,ST. BONAVENTURE PARISH,Charitable Organization,107909939RR0060,Christianity,Catholic,,,CALGARY,WWW.STBONAVENTUREPARISH.CA,RC DIOCESE OF CALGARY,1600 ACADIA DRIVE SE,T2J3B3,1974-10-29 00:00:00
1,St. Bonaventure Roman Catholic Parish Scholarship Society,Charitable Organization,886155795RR0001,Support of schools and education,Other,,,CALGARY,"",St. Bonaventure Roman Catholic Parish Scholarship Society,44 LAKE LINNET CLOSE SE,T2J2J1,1988-07-01 00:00:00
1,ST. BONIFACE CHURCH,Charitable Organization,107909939RR0064,Christianity,Catholic,,,CALGARY,STBONIFACECALGARY.COM,RC DIOCESE OF CALGARY,1923 BROADVIEW RD NW,T2N3H6,1967-01-01 00:00:00
1,ST. BONIFACE SCHOOL EDUCATIONAL SOCIETY,Charitable Organization,875776270RR0001,Support of schools and education,School councils (parent-teacher associations),,,CALGARY,"",ST. BONIFACE SCHOOL EDUCATIONAL SOCIETY,927 LAKE SYLVAN DR SE,T2J2P8,1998-10-06 00:00:00
1,ST. CATHERINE EDUCATIONAL SOCIETY,Charitable Organization,887982643RR0001,Foundations Advancing Education,Foundations funding educational QDs in general,,,CALGARY,"",ST. CATHERINE EDUCATIONAL SOCIETY,11 CANATA CLOSE SW,T2W1P6,1985-12-20 00:00:00
1,ST. CECILIA'S CHURCH,Charitable Organization,107909939RR0061,Christianity,Catholic,,,CALGARY,"",RC DIOCESE OF CALGARY,321 90 AVE SE,T2J0A1,1967-01-01 00:00:00
1,ST. DAVID'S UNITED CHURCH,Charitable Organization,108012527RR0001,Christianity,United,,,CALGARY,WWW.SDUC.CA,ST. DAVID'S UNITED CHURCH,3303 CAPITOL HILL CR NW,T2M2R2,1967-01-01 00:00:00
1,ST. DOMINIC EDUCATIONAL SOCIETY,Charitable Organization,132344391RR0001,Support of schools and education,Other,,,CALGARY,WWW.STDOMINICEDSOCIETY.COM,ST. DOMINIC EDUCATIONAL SOCIETY,4820 DALHART ROAD NW,T3A1C2,1988-08-29 00:00:00
1,St. Elijah Orthodox Church,Charitable Organization,859790826RR0001,Christianity,Orthodox,,,CALGARY,"",ST. ELIJAH ORTHODOX CHURCH,"PO BOX 21009, DOMINION POSTAL STATION SW",T2P4H5,2011-08-11 00:00:00
1,ST. ELIZABETH OF HUNGARY CHURCH,Charitable Organization,107909939RR0065,Christianity,Catholic,,,CALGARY,"",RC DIOCESE OF CALGARY,819-13TH AVE SW,T2R0L1,1967-01-01 00:00:00
1,ST. FRANCIS CHURCH,Charitable Organization,107909939RR0024,Christianity,Catholic,,,CALGARY,WWW.GCATHOLIC.ORG,RC DIOCESE OF CALGARY,604 FIRST ST SE,T2G4W4,1983-01-01 00:00:00
1,ST. GERARDS PARISH,Charitable Organization,107909939RR0019,Christianity,Catholic,,,CALGARY,WWW.STGERARDS.CA,RC DIOCESE OF CALGARY,8944 ELBOW DRIVE S W,T2V1L2,1967-01-01 00:00:00
1,ST. JAMES CHURCH,Charitable Organization,107909939RR0025,Christianity,Catholic,,,CALGARY,STJAMESCALGARY.ORG,RC DIOCESE OF CALGARY,5504 20TH ST.S.W.,T3E1R2,1967-01-01 00:00:00
1,St. John Chrysostom Russian Orthodox Church of Calgary,Charitable Organization,814796918RR0001,Christianity,Orthodox,,,CALGARY,CALGARY-ORTHODOX.CA,ST. JOHN CHRYSOSTOM ORTHODOX MINISTRY OF CALGARY,"14608 MACLEOD TRAIL, SE",T2X1Z7,2012-01-23 00:00:00
1,ST. JOHN HENRY NEWMAN SCHOOL EDUCATION SOCIETY,Charitable Organization,889069530RR0001,Support of schools and education,Other,,,CALGARY,"",ST. JOHN HENRY NEWMAN SCHOOL EDUCATION SOCIETY,16201 MCKENZIE LAKE BLVD S.E.,T2Z2G7,1997-09-08 00:00:00
1,ST. JOHN OF SHANGHAI AND SAN FRANCISCO RUSSIAN ORTHODOX CHURCH OUTSIDE OF RUSSIA OF CALGARY,Charitable Organization,761103530RR0001,Christianity,Orthodox,,,CALGARY,"",ST. JOHN OF SHANGHAI AND SAN FRANCISCO RUSSIAN ORTHODOX CHURCH OUTSIDE OF RUSSIA OF CALGARY,411 CHAPARRAL RIDGE CIR SE,T2X3Y1,2020-01-01 00:00:00
1,St. John the Baptist Deanery,Charitable Organization,784705881RR0001,Christianity,Catholic,,,CALGARY,"",ST. JOHN THE BAPTIST DEANERY,1423 8 AVENUE SOUTHEAST,T2G0N1,2018-01-09 00:00:00
1,ST. JOSEPH'S CHURCH,Charitable Organization,107909939RR0020,Christianity,Catholic,,,CALGARY,WWW.STJOSEPHCALGARY.COM,RC DIOCESE OF CALGARY,640-19TH AVENUE NW,T2M0Y8,1967-01-01 00:00:00
1,ST. LUKE'S CHURCH,Charitable Organization,107909939RR0066,Christianity,Catholic,,,CALGARY,WWW.STLUKESCHURCH.CA,RC DIOCESE OF CALGARY,1566 NORTH MOUNT DRIVE NW,T2L0G6,1967-01-01 00:00:00
1,ST. MARKS PARISH,Charitable Organization,107909939RR0021,Christianity,Catholic,,,CALGARY,"",RC DIOCESE OF CALGARY,5552 MADIGAN DRIVE NE,T2A4P2,1974-01-01 00:00:00
1,ST. MARTIN' S ANGLICAN CHURCH OF CANADA,Charitable Organization,108029463RR0001,Christianity,Anglican,,,CALGARY,"",ST. MARTIN' S ANGLICAN CHURCH OF CANADA,3704 37 ST SW,T3E3C3,1967-01-01 00:00:00
1,St. Mary & St. Paul Coptic Orthodox Church of Calgary,Charitable Organization,774696520RR0001,Christianity,Other,,,CALGARY,"",St. Mary & St. Paul Coptic Orthodox Church of Calgary,PO BOX 34251 RPO WESTBROOK,T3C3W2,2016-03-11 00:00:00
1,ST. MARY ROMANIAN ORTHODOX PARISH OF CALGARY,Charitable Organization,108029729RR0001,Christianity,Orthodox,,,CALGARY,SAINTMARYSCALGARY.ORG,ST. MARY ROMANIAN ORTHODOX PARISH OF CALGARY,3511 3RD AVE.S.W.,T3C0A7,1997-01-01 00:00:00
1,ST. MARY'S CATHEDRAL,Charitable Organization,107909939RR0010,Christianity,Catholic,,,CALGARY,"",RC DIOCESE OF CALGARY,219-18 AVE S W,T2S0C2,1967-01-01 00:00:00
1,St. Mary's Chaldean Catholic Church,Charitable Organization,705654911RR0001,Christianity,Catholic,,,CALGARY,"",St. Mary's Chaldean Catholic Church,5504 20 ST SW,T3E1R2,2007-01-16 00:00:00
1,ST. MARY'S MALANKARA ORTHODOX CHURCH - CALGARY,Charitable Organization,872867304RR0001,Christianity,Other,,,CALGARY,WWW.STMARYSORTHODOXCHURCHCALGARY.COM,ST MARY'S MALANKARA ORTHODOX CHURCH - CALGARY,73 PANTEGO LANE NW,T3K0T1,2004-01-01 00:00:00
1,St. Mary's University,Charitable Organization,119188944RR0001,Teaching Institutions,Other,,,CALGARY,WWW.STMU.CA,ST MARY'S UNIVERSITY,14500 BANNISTER RD SE,T2X1Z4,1987-01-01 00:00:00
1,ST. MATTHEW LUTHERAN CHURCH,Charitable Organization,108031428RR0001,Christianity,Protestant,,,CALGARY,"",ST. MATTHEW LUTHERAN CHURCH,"66-7TH ST. N. E.,",T2E4B7,1967-01-01 00:00:00
1,ST. MICHAEL'S CHURCH,Charitable Organization,107909939RR0026,Christianity,Catholic,,,CALGARY,SAINTMICHAEL.CA,RC DIOCESE OF CALGARY,800 85 ST SW,T3H4C7,1967-01-01 00:00:00
1,ST. PATRICK'S CHURCH,Charitable Organization,107909939RR0062,Christianity,Catholic,,,CALGARY,WWW.STPATRICKCALGARY.COM,RC DIOCESE OF CALGARY,1414 SHAWNESSY BLVD S.W,T2Y2L7,1967-01-01 00:00:00
1,ST. PETER'S ANGLICAN CHURCH,Charitable Organization,108038357RR0001,Christianity,Anglican,,,CALGARY,WWW.STPETERSCALGARY.CA,ST. PETER'S ANGLICAN CHURCH,903-75 AVE. S.W.,T2V0S7,1967-01-01 00:00:00
1,ST. PETER'S PARISH,Charitable Organization,107909939RR0027,Christianity,Catholic,,,CALGARY,WWW.ST-PETERS.CA,RC DIOCESE OF CALGARY,541 SILVERGROVE DR NW,T3B4R9,1977-06-01 00:00:00
1,ST. PIUS X CHURCH,Charitable Organization,107909939RR0063,Christianity,Catholic,,,CALGARY,WWW.STPIUSX.CA,RC DIOCESE OF CALGARY,2424-24 AVENUE N.W.,T2M2A2,1967-01-01 00:00:00
1,ST. STEPHEN PROTOMARTYR UKRAINIAN CATHOLIC CHURCH,Charitable Organization,108042334RR0001,Christianity,Catholic,,,CALGARY,SAINTSTEPHENCALGARY.CA,ST. STEPHEN PROTOMARTYR UKRAINIAN CATHOLIC CHURCH,4903-45TH STREET S.W.,T3E3W5,1967-01-01 00:00:00
1,"St. Thomas Jacobite Syriac Orthodox Church, Calgary",Charitable Organization,804202711RR0001,Christianity,Other,,,CALGARY,STTHOMASCALGARY.COM,"ST.THOMAS JACOBITE SYRIAC ORTHODOX CHURCH, CALGARY",209 - 1829 54 ST SE,T2B1N5,2011-07-29 00:00:00
1,ST. THOMAS MORE PARISH,Charitable Organization,107909939RR0067,Christianity,Catholic,,,CALGARY,"",RC DIOCESE OF CALGARY,15 TEMPLEBOW ROAD NE,T1Y6J3,1979-09-01 00:00:00
1,ST. VLADIMIR'S UKRAINIAN ORTHODOX CONGREGATION AT CALGARY,Charitable Organization,129720231RR0001,Christianity,Orthodox,,,CALGARY,"",ST. VLADIMIR'S UKRAINIAN ORTHODOX CONGREGATION AT CALGARY,404 MEREDITH RD NE,T2E5A6,1997-11-01 00:00:00
1,STANISLAW GRABOWIECKI (GEORGE STEPHEN STANLEY) MEMORIAL FOUNDATION,Private Foundation,888832441RR0001,Foundations Advancing Religions,Foundations funding religious QDs in general,,,CALGARY,"",STANISLAW GRABOWIECKI (GEORGE STEPHEN STANLEY) MEMORIAL FOUN,2300 - 335 8 AVE SW,T2P1C9,1979-07-01 00:00:00
1,STARDALE WOMEN'S GROUP INCORPORATED,Charitable Organization,894942622RR0001,Organizations Relieving Poverty,Other,,,CALGARY,"",STARDALE WOMEN'S GROUP INCORPORATED,33 POINT MCKAY CRES NW,T3B5C3,1998-10-26 00:00:00
1,Starratt Family Foundation,Private Foundation,821116449RR0001,Foundations,Foundations funding community benefit QDs in general,,,CALGARY,"",Starratt Family Foundation,119 VARSITY ESTATES TERRACE NW,T3B5J6,2013-04-01 00:00:00
1,Step By Step Early Intervention Society,Charitable Organization,807282587RR0001,Community Resource,Other,,,CALGARY,STEPBYSTEPEIP.CA,Step By Step Early Intervention Society,103 - 5855 9 ST SE,T2H1Z9,2015-11-17 00:00:00
1,Sterile Processing Education Charitable Trust,Charitable Organization,850467978RR0001,Foundations,Foundations for specified community benefit,,,CALGARY,WWW.SPECTRUST.ORG,STERILE PROCESSING EDUCATION CHARITABLE TRUST,"5115 VANSTONE CRESCENT, NORTHWEST",T3A0W1,2013-08-08 00:00:00
1,STOREHOUSE-39-3-10,Charitable Organization,849238720RR0001,Organizations Relieving Poverty,Other,,,CALGARY,WWW.STOREHOUSE39-3-10,STOREHOUSE-39-3-10,3751 21 ST NE,T2E6T5,2006-09-18 00:00:00
1,STORYBOOK THEATRE SOCIETY,Charitable Organization,119192854RR0001,Education in the arts,Theatre / film / drama school / society / company,,,CALGARY,www.storybooktheatre.org,STORYBOOK THEATRE SOCIETY,375 BERMUDA DR NW,T3K2J5,1985-07-01 00:00:00
1,STRAIGHT TALK MINISTRIES ASSOCIATION,Charitable Organization,893919373RR0001,Support of Religion,Other,,,CALGARY,WWW.STRAIGHTTALKMINISTRIES.COM,STRAIGHT TALK MINISTRIES ASSOCIATION,38 RIVER ROCK CRESCENT S.E.,T2C4J4,1994-05-12 00:00:00
1,STRATHCONA-TWEEDSMUIR SCHOOL FOUNDATION,Charitable Organization,861546927RR0001,Foundations Advancing Education,Foundations for specified educational charities,,,CALGARY,"",STRATHCONA-TWEEDSMUIR SCHOOL FOUNDATION,"4500, 855-2ND STREET S.W.",T2P4K7,2001-10-11 00:00:00
1,STRIDE ART GALLERY ASSOCIATION,Charitable Organization,120561352RR0001,Arts,Other,,,CALGARY,WWW.STRIDE.AB.CA,STRIDE ART GALLERY ASSOCIATION,1006 MACLEOD TRAIL SE,T2G2M7,1989-07-06 00:00:00
1,Strive4 Education Charitable Foundation,Charitable Organization,786830497RR0001,Support of schools and education,Scholarships / bursaries / awards (scholastic achievement),,,CALGARY,"",STRIVE4 EDUCATION CHARITABLE FOUNDATION,64 WENTWORTH LANDNG SW,T3H5X1,2017-07-01 00:00:00
1,Strongroom Foundation,Private Foundation,784440281RR0001,Foundations,Foundations funding community benefit QDs in general,,,CALGARY,"",Strongroom Foundation,621 22 AVENUE SOUTHWEST,T2S0H7,2018-01-01 00:00:00
1,STUDENT LEGAL ASSISTANCE SOCIETY (CALGARY),Charitable Organization,868183443RR0001,Community Resource,Legal assistance and services (mediation),,,CALGARY,WWW.SLACALGARY.COM,STUDENT LEGAL ASSISTANCE SOCIETY (CALGARY),"3390 MURRAY FRASER HALL, 2500 UNIVERSITY DRIVE N W",T2N1N4,1998-04-01 00:00:00
1,STUDENTS AGAINST DRINKING & DRIVING ASSOCIATION OF ALBERTA,Charitable Organization,136029881RR0001,Core Health Care,Rehabilitation programs and centres,,,CALGARY,SADDALBERTA.COM,STUDENTS AGAINST DRINKING & DRIVING ASSOCIATION OF ALBERTA,"P.O. BOX 7220, STN CENTRAL",T2P3M1,1991-01-08 00:00:00
1,SUDDEN IMPACT EDUCATIONAL MINISTRIES SOCIETY,Charitable Organization,865065098RR0001,Support of Religion,Other,,,CALGARY,SUDDENIMPACTYOUTH.COM,SUDDEN IMPACT EDUCATIONAL MINISTRIES SOCIETY,50 HARVEST OAK GATE NE,T3K4G8,2001-03-30 00:00:00
1,Summit (Mennonite Brethren) Christian Fellowship Church,Charitable Organization,757732672RR0001,Christianity,Catholic,,,CALGARY,www.summitcalgary.church,Summit (Mennonite Brethren) Christian Fellowship Church,209 - 240 MIDPARK WAY SE,T2X1N4,2020-03-15 00:00:00
1,Summit Foundation For Cystic Fibrosis,Public Foundation,852856723RR0001,Foundations,Foundations for specified community benefit,,,CALGARY,"",SUMMIT FOUNDATION FOR CYSTIC FYBROSIS,"PO BOX 87071, RPO DOUGLAS SQUARE",T2Z3V7,2019-01-01 00:00:00
1,SUNALTA SCHOOL PARENTS SOCIETY,Charitable Organization,105065445RR0001,Support of schools and education,Other,,,CALGARY,"",SUNALTA SCHOOL PARENTS SOCIETY,536 SONORA AVE. SW,T2C2J9,1985-01-01 00:00:00
1,SUNCOR ENERGY FOUNDATION/FONDATION SUNCOR ENERGIE,Private Foundation,890381882RR0001,Foundations,Foundations funding community benefit QDs in general,,,CALGARY,"",SUNCOR ENERGY FOUNDATION/FONDATION SUNCOR ENERGIE,"PO BOX 2844, 150 6 AVE SW",T2P3E3,1997-01-01 00:00:00
1,SUNNYSIDE (ELEMENTARY) COMMUNITY SCHOOL SOCIETY,Public Foundation,876306077RR0001,Teaching Institutions,Other,,,CALGARY,"",SUNNYSIDE (ELEMENTARY) COMMUNITY SCHOOL SOCIETY,211 - 7 STREET N.W.,T2N1S2,2004-07-07 00:00:00
1,"Sunridge Spanish Congregation of Jehovah's Witnesses, Calgary, Alberta",Charitable Organization,764332714RR0001,Christianity,Jehovahs Witnesses,,,CALGARY,"","Sunridge Spanish Congregation of Jehovah's Witnesses, Calgary, Alberta",36-336 RUNDLEHILL DRIVE NE,T1Y2Y2,1989-01-01 00:00:00
1,SUNRISE COMMUNITY LINK RESOURCE CENTRE SOCIETY,Charitable Organization,863566592RR0001,Community Resource,Other,,,CALGARY,www.sunriselink.org,SUNRISE COMMUNITY LINK RESOURCE CENTRE SOCIETY,3303 17 AVE SE,T2A0R2,2004-07-13 00:00:00
