1,INSPIRE!africa FOUNDATION,Charitable Organization,838931764RR0001,Organizations Relieving Poverty,Other,,,CALGARY,WWW.INSPIREAFRICA.ORG,INSPIRE!africa FOUNDATION,102 - 520 CEDAR CRES SW,T3C2Y8,2007-10-31 00:00:00
1,INSTITUTE FOR CHURCH PARTNERSHIP EVANGELISM,Charitable Organization,887478071RR0001,Support of Religion,"Facilitator organization supporting, improving, and enhancing the work of groups involved in the advancement of religion",,,CALGARY,CPEONLINE.ORG,INSTITUTE FOR CHURCH PARTNERSHIP EVANGELISM,"BOX 49093, 7740-18TH ST SE",T2C2N5,1997-08-29 00:00:00
1,INSTRUMENTAL SOCIETY OF CALGARY,Charitable Organization,119049815RR0001,Arts,Other,,,CALGARY,INSTRUMENTALSOCIETY.CA,INSTRUMENTAL SOCIETY OF CALGARY,1121 14 AVE SW,T2R0P3,1979-07-05 00:00:00
1,IntegralOrg,Charitable Organization,795130129RR0001,Community Resource,Facilitator organization supporting and enhancing the work of groups involved in the delivery of charitable programs,,,CALGARY,"",IntegralOrg,802 - 5920 MACLEOD TRAIL SW,T2H0K2,2017-01-01 00:00:00
1,INTERNATIONAL AVENUE ARTS AND CULTURE CENTRE,Charitable Organization,869328310RR0001,Arts,Other,,,CALGARY,WWW.IAACC.CA,INTERNATIONAL AVENUE ARTS AND CULTURE CENTRE,250 - 3515 17 AVE SE,T2A0R5,2003-09-01 00:00:00
1,International Nepal Fellowship Canada,Charitable Organization,824727978RR0001,Core Health Care,Treatment / preventative care for specific disease / health condition,,,CALGARY,"",INTERNATIONAL NEPAL FELLOWSHIP CANADA,"PO BOX 91112, ROYAL OAK RPO",T3G5W6,2014-06-26 00:00:00
1,"INTERNATIONAL SOCIETY FOR ENDANGERED CATS, INC",Charitable Organization,133088641RR0001,Animal Welfare,Other,,,CALGARY,WWW.WILDCATCONSERVATION.ORG,"INTERNATIONAL SOCIETY FOR ENDANGERED CATS, INC",124 LYNNBROOK ROAD S.E.,T2C1S6,1990-05-09 00:00:00
1,International Translators and Interpreters Foundation,Charitable Organization,832454649RR0001,Teaching Institutions,Vocational / technical school,,,CALGARY,INTTA.CA,International Translators and Interpreters Foundation,300 - 404 6 AVE SW,T2P0R9,2013-12-15 00:00:00
1,International Vision Organization,Private Foundation,813505724RR0001,Core Health Care,Treatment / preventative care for specific disease / health condition,,,CALGARY,WWW.INVISIONORG.COM,INTERNATIONAL VISION ORGANIZATION,44 COLERIDGE CRES NW,T2K1X9,2016-03-09 00:00:00
1,ISLAMIC INFORMATION SOCIETY OF CALGARY,Charitable Organization,871722617RR0001,Islam,Other,,,CALGARY,WWW.IISC.CA,ISLAMIC INFORMATION SOCIETY OF CALGARY,PO BOX 64295 RPO THORNCLIFFE,T2K6J7,2012-05-01 00:00:00
1,ISRAEL KOSCHITZKY FAMILY CHARITABLE FOUNDATION,Private Foundation,131580565RR0001,Foundations,Foundations funding community benefit QDs in general,,,CALGARY,"",ISRAEL KOSCHITZKY FAMILY CHARITABLE FOUNDATION,"900 MCFARLANE TOWER, 700-4TH AVENUE SW",T2P3J4,1974-09-02 00:00:00
1,ITLMA FOUNDATION,Private Foundation,872723150RR0001,Foundations,Foundations funding community benefit QDs in general,,,CALGARY,"",ITLMA FOUNDATION,142 DALHOUSIE ROAD N.W.,T3A2H1,1999-01-19 00:00:00
1,J.G.D. CHIEFS PARENT ASSOCIATION,Charitable Organization,886561190RR0001,Support of schools and education,Other,,,CALGARY,"",J.G.D. CHIEFS PARENT ASSOCIATION,6620 - 4TH STREET N.W.,T2K1C2,1994-09-01 00:00:00
1,JACK LONG FOUNDATION FOR COMMUNITY DEVELOPMENT,Public Foundation,862875317RR0001,Foundations,Foundations funding community benefit QDs in general,,,CALGARY,WWW.JACKLONGFOUNDATION.COM,JACK LONG FOUNDATION FOR COMMUNITY DEVELOPMENT,104 - 808 5 ST SE,T2G4T5,2004-04-01 00:00:00
1,Jacques Family Foundation Inc.,Private Foundation,792774291RR0001,Foundations,Foundations funding community benefit QDs in general,,,CALGARY,"",JACQUES FAMILY FOUNDATION INC.,2712 MARQUETTE ST. SW,T2T3E3,2015-12-17 00:00:00
1,"Jam Tse Cho Ling Tibetan Buddhist Temple, Calgary",Charitable Organization,811478239RR0001,Other Religions,Buddhism,,,CALGARY,"","Jam Tse Cho Ling Tibetan Buddhist Temple, Calgary",96 WHITEHAVEN CRESCENT NE,T1Y6C5,2019-04-23 00:00:00
1,JAMIE'S PRE-SCHOOL SOCIETY,Charitable Organization,118972835RR0001,Teaching Institutions,Other,,,CALGARY,WWW.JAMIESPRESCHOOL.CA,JAMIE'S PRE-SCHOOL SOCIETY,3303 CAPITOL HILL CRES NW,T2M2R2,1987-08-25 00:00:00
1,JANUS ACADEMY SOCIETY,Charitable Organization,889704144RR0001,Teaching Institutions,Other,,,CALGARY,WWW.JANUSACADEMY.ORG,JANUS ACADEMY SOCIETY,200 - 403 33 ST NE,T2A1X5,1996-11-15 00:00:00
1,Jazz is Society of Alberta,Charitable Organization,864292727RR0001,Education in the arts,Music conservatory / school / society,,,CALGARY,"",JAZZ IS SOCIETY OF ALBERTA,PO BOX 46054 RPO INGLEWOOD,T2G5H7,2015-10-23 00:00:00
1,Jeff Loewen Ministries,Charitable Organization,845438514RR0001,Support of Religion,Mission / Missionary organization,,,CALGARY,WWW.JLMIN.ORG,Jeff Loewen Ministries,BOX 44008 RPO SOUTHCENTRE,T2J7C5,2012-08-01 00:00:00
1,Jesus First Christian Ministries of Calgary,Charitable Organization,820863868RR0001,Christianity,Other,,,CALGARY,WWW.JFCMALBERTA.ORG,Jesus First Christian Ministries of Calgary,8306 SADDLEBROOK DR NE,T3J0M6,2010-09-14 00:00:00
1,"Jesus is Light Ministries, Calgary",Charitable Organization,833736580RR0001,Christianity,Other,,,CALGARY,"","JESUS IS LIGHT MINISTRIES, CALGARY",118 TARALAKE WAY NE,T3J0A7,2015-03-24 00:00:00
1,JESUS LOVES YOU SOCIETY OF CALGARY,Charitable Organization,897155750RR0001,Organizations Relieving Poverty,Other,,,CALGARY,"",JESUS LOVES YOU SOCIETY OF CALGARY,240 15 AVE SW,T2R0P7,1995-08-02 00:00:00
1,Jesus Miracle Crusade International Ministry in Calgary Alberta Under Evangelist Wilde E. Almeda,Private Foundation,803489988RR0001,Christianity,Other,,,CALGARY,"",JESUS MIRACLE CRUSADE INT'L MINISTRY IN CALGARY ALBERTA UNDER EVANGELIST WILDE E. ALMEDA,58 SKYVIEW SHORES CRES NE,T3N0C4,2018-08-30 00:00:00
1,Jesus Our Victory Global Outreach Calgary,Charitable Organization,762233914RR0001,Christianity,Other,,,CALGARY,"",JESUS OUR VICTORY GLOBAL OUTREACH CALGARY,27 MARTIN CROSSING MANOR NE,T3J4H9,2019-01-01 00:00:00
1,Jesus Reigns Forever International Ministry Calgary,Charitable Organization,803628841RR0001,Christianity,Other,,,CALGARY,"",Jesus Reigns Forever International Ministry,1513 - 1121 6 AVE SW,T2P5J4,2015-01-01 00:00:00
1,Jesus Word of Life International Fellowship,Charitable Organization,817717820RR0001,Christianity,Other,,,CALGARY,WWW.JESUSWORDOFLIFE.ORG,Jesus Word of Life International Fellowship,13 REDSTONE DR NE,T3N0N1,2009-02-04 00:00:00
1,Jeunesse Classique Ballet Society,Charitable Organization,872869664RR0001,Arts,Arts festival,,,CALGARY,WWW.JCBS.CA,JEUNESSE CLASSIQUE BALLET SOCIETY,125S - 8500 MACLEOD TRAIL SE,T2H2N1,2009-08-20 00:00:00
1,JEWISH COMMUNITY FOUNDATION OF CALGARY,Public Foundation,896356771RR0001,Foundations,Foundations funding community benefit QDs in general,,,CALGARY,WWW.JCFC.CA,JEWISH COMMUNITY FOUNDATION OF CALGARY,1607 90 AVE SW,T2V4V7,1990-01-25 00:00:00
1,JEWISH FAMILY SERVICE (CALGARY),Charitable Organization,118974252RR0001,Organizations Relieving Poverty,Other,,,CALGARY,WWW.JFSC.ORG,JEWISH FAMILY SERVICES (CALGARY),420-5920 1A ST SW,T2H0G3,1989-03-04 00:00:00
1,JEWISH HISTORICAL SOCIETY OF SOUTHERN ALBERTA,Charitable Organization,121811913RR0001,Public Amenities,Other,,,CALGARY,jhssa.org,JEWISH HISTORICAL SOCIETY OF SOUTHERN ALBERTA,1607 - 90 AVENUE S.W.,T2V4V7,1990-09-01 00:00:00
1,Jim And Janice Parker Foundation Inc.,Private Foundation,800996944RR0001,Foundations,Foundations funding community benefit QDs in general,,,CALGARY,"",Jim and Janice Parker Foundation Inc.,4304 CORONATION DRIVE SW,T2S1M2,2015-11-04 00:00:00
1,JOHN AND ELSIE COLLINS FOUNDATION,Private Foundation,844825968RR0001,Foundations,Foundations funding community benefit QDs in general,,,CALGARY,"",JOHN AND ELSIE COLLINS FOUNDATION,1400 - 777 - 8TH AVENUE S.W.,T2P3R5,2007-01-01 00:00:00
1,JOHN CAMPBELL ARMSTRONG EDUCATIONAL FOUNDATION,Charitable Organization,887437838RR0001,Support of schools and education,Scholarships / bursaries / awards (scholastic achievement),,,CALGARY,"",JOHN CAMPBELL ARMSTRONG EDUCATIONAL FOUNDATION,123 DISCOVERY RIDGE BAY SW,T3H5T7,1997-08-01 00:00:00
1,John Petropoulos Memorial Fund Society,Charitable Organization,807275870RR0001,Protective Health Care,Safety council / society,,,CALGARY,WWW.JPMF.CA,JOHN PETROPOULOS MEMORIAL FUND SOCIETY,347-440-10816 MACLEOD TR SE,T2J5N8,2011-03-14 00:00:00
1,Journey Church,Charitable Organization,875180424RR0001,Christianity,Pentecostal,,,CALGARY,NWFCHURCH.COM,Journey Church,10307 EAMON ROAD NW,T3G5H2,1990-01-01 00:00:00
1,Joy Overflow International Church,Charitable Organization,749471520RR0001,Christianity,Other,,,CALGARY,"",JOY OVERFLOW INTERNATIONAL CHURCH,2013 39 AVE NE,T2E6R7,2017-03-31 00:00:00
1,JUNIOR ACHIEVEMENT OF SOUTHERN ALBERTA,Charitable Organization,107554396RR0001,Support of schools and education,Other,,,CALGARY,WWW.JASOUTHALBERTA.ORG,JUNIOR ACHIEVEMENT OF SOUTHERN ALBERTA,870-105 12 AVE SE,T2G1A1,1967-01-01 00:00:00
1,Juno Beach Squadron Sponsoring Committee,Charitable Organization,852387448RR0001,Educational organizations not elsewhere categorized,Cadets,,,CALGARY,"",JUNO BEACH SQUADRON SPONSORING COMMITTEE,10800 84 ST SE,T3S0A5,2012-07-09 00:00:00
1,Justice Centre for Constitutional Freedoms,Charitable Organization,817174865RR0001,Upholding Human Rights,Other,,,CALGARY,www.jccf.ca,JUSTICE CENTRE FOR CONSTITUTIONAL FREEDOM,"PO BOX 253, 7620 ELBOW DRIVE SW",T2V1K2,2010-10-04 00:00:00
1,K O Arts Centre Society of Calgary,Charitable Organization,833914955RR0001,Arts,Other,,,CALGARY,WWW.KOARTSCENTRE.ORG,K O ARTS CENTRE SOCIETY OF CALGARY,244034 HORIZON VIEW ROAD,T3Z3M5,2010-04-01 00:00:00
1,K.C. Hymners Music Ministry Society,Private Foundation,831252119RR0001,Education in the arts,Other,,,CALGARY,"",K.C. Hymners Music Ministry Society,1522 11 AVE SW,T3C0M9,2011-08-22 00:00:00
1,K.O. Arts Foundation of Calgary,Public Foundation,816882757RR0001,Foundations Advancing Education,Foundations for specified educational charities,,,CALGARY,WWW.KOARTSCENTRE.ORG,K.O. ARTS FOUNDATION OF CALGARY,244034 HORIZON VIEW ROAD,T3Z3M5,2010-04-01 00:00:00
1,Kairos Evangelistic Ministries,Charitable Organization,862098415RR0001,Christianity,Other,,,CALGARY,WWW.KAIROSMINISTRIES.CA.ORG,KAIROS EVANGELISTIC MINISTRIES,31 MARTINWOOD WAY NE,T3J3H1,2016-06-17 00:00:00
1,Kali's Wish Cancer Foundation Calgary,Charitable Organization,870619905RR0001,Animal Welfare,Other,,,CALGARY,www.kaliswish.org,KALI'S WISH CANCER FOUNDATION CALGARY,5490 76 AVE SE,T2C4S3,2020-01-30 00:00:00
1,KAMTSANG CHOLING CALGARY BUDDHIST SOCIETY,Charitable Organization,891430324RR0001,Other Religions,Buddhism,,,CALGARY,WWW.DIAMONDWAY.ORG/CALGARY,KAMTSANG CHOLING CALGARY BUDDHIST SOCIETY,4224 5A ST SW,T2S2G7,1999-10-16 00:00:00
1,KANOVSKY FAMILY FOUNDATION,Private Foundation,844114678RR0001,Foundations,Foundations funding community benefit QDs in general,,,CALGARY,"",KANOVSKY FAMILY FOUNDATION,310 - 440 2 AVE SW,T2P5E9,2005-07-25 00:00:00
1,KANTOREI CHORAL SOCIETY,Charitable Organization,896537842RR0001,Education in the arts,Music conservatory / school / society,,,CALGARY,WWW.MRU.CA/KANTOREI,KANTOREI CHORAL SOCIETY,4825 MOUNT ROYAL GATE SW,T3E6K6,2002-09-01 00:00:00
1,KARA COMMUNITY ADVISORY ASSOCIATION,Charitable Organization,895392884RR0001,Support of schools and education,Other,,,CALGARY,WWW.KARAPROGRAM.COM,KARA COMMUNITY ADVISORY ASSOCIATION,41 PANORAMA HILLS HEIGHTS NW,T3K5P1,1994-01-01 00:00:00
1,"Karen Baptist Church of Calgary Alberta, Canada",Charitable Organization,849654975RR0001,Christianity,Other,,,CALGARY,"",KAREN BAPTIST CHURCH,196 TARINGTON CLOSE NE,T3J3V7,2013-09-30 00:00:00
1,Kehilat Shalom Society of Calgary,Charitable Organization,824724439RR0001,Judaism,Other,,,CALGARY,KSCALGARY.ORG,KEHILAT SHALOM SOCIETY OF CALGARY,11 SINCLAIR CRESCENT SOUTHWEST,T2W0L8,2014-03-07 00:00:00
1,KERBY ASSEMBLY,Charitable Organization,118979947RR0001,Organizations Relieving Poverty,Other,,,CALGARY,WWW.KERBYCENTRE.COM,KERBY ASSEMBLY,1133 7 AVE SW,T2P1B2,1976-04-01 00:00:00
1,Keys of the Kingdom Ministries - Life in the Spirit Fellowship Alberta Chapter,Charitable Organization,857172399RR0001,Christianity,Other,,,CALGARY,"",KEYS OF THE KINGDOM MINISTRIES - LIFE IN THE SPIRIT FELLOWSHIP ALBERTA CHAPTER,10 - 3850 19 ST NE,T2E6V2,2013-01-28 00:00:00
1,Khalsa School Calgary Educational Foundation,Charitable Organization,848285961RR0001,Teaching Institutions,Other,,,CALGARY,"",Khalsa School Calgary Educational Foundation,RR 6 LCD 9,T2M4L5,2018-09-10 00:00:00
1,KHMER-CANADIAN BUDDHIST CULTURAL SOCIETY,Charitable Organization,877292094RR0001,Other Religions,Buddhism,,,CALGARY,"",KHMER-CANADIAN BUDDHIST CULTURAL SOCIETY,7011 OGDEN RD SE,T2C1B5,2005-06-15 00:00:00
1,Kids Brain Cancer Canada Inc.,Public Foundation,807148572RR0001,Foundations,Foundations for specified community benefit,,,CALGARY,WWW.CCBCF.ORG,KIDS BRAIN CANCER CANADA INC.,91 CRANFORD GREEN SE,T3M1V2,2015-04-02 00:00:00
1,KIDS CANCER CARE FOUNDATION OF ALBERTA,Charitable Organization,899409171RR0001,Public Amenities,Camps / recreation,,,CALGARY,KIDSCANCERCARE.AB.CA,KIDS CANCER CARE FOUNDATION OF ALBERTA,5757 4 ST SE,T2H1K8,1994-10-26 00:00:00
1,KIDS UP FRONT FOUNDATION (CALGARY),Charitable Organization,863522124RR0001,Organizations Relieving Poverty,Other,,,CALGARY,WWW.KIDSUPFRONTCALGARY.COM,KIDS UP FRONT FOUNDATION (CALGARY),110-105 12TH AVE SE,T2G1A1,2000-07-13 00:00:00
1,KIDS WORLD OUTREACH SOCIETY,Charitable Organization,890734148RR0001,Foundations,Foundations for specified community benefit,,,CALGARY,"",KIDS' WORLD OUTREACH SOCIETY,410-10TH STREET NE,T2E4M3,1992-07-20 00:00:00
1,KIDZINC SCHOOL AGE CARE SOCIETY OF ALBERTA,Charitable Organization,893838466RR0001,Organizations Relieving Poverty,Other,,,CALGARY,WWW.CALGARYKIDZINC.CA,KIDZINC SCHOOL AGE CARE SOCIETY OF ALBERTA,4411 10 AVE SW,T3C0L9,1991-09-01 00:00:00
1,Killarney Parent Fundraising Society,Charitable Organization,888181013RR0001,Support of schools and education,School councils (parent-teacher associations),,,CALGARY,"",KILLARNEY PARENT FUNDRAISING SOCIETY,3008-33 ST SW,T3E2T9,2012-09-27 00:00:00
1,KING GEORGE MASONIC TEMPLE,Charitable Organization,106144801RR0001,Foundations,Foundations funding community benefit QDs in general,,,CALGARY,"",KING GEORGE MASONIC TEMPLE,331 - 3750 46 AVE SE,T2B0L1,1990-05-29 00:00:00
1,KING OF GLORY LUTHERAN CHURCH OF CALGARY ALBERTA,Charitable Organization,118981646RR0001,Christianity,Protestant,,,CALGARY,kingofglory.ca,KING OF GLORY LUTHERAN CHURCH OF CALGARY ALBERTA,2640 RUNDLELAWN ROAD N.E.,T1Y5X3,1978-11-05 00:00:00
1,Kingdom Life Ministries Calgary,Private Foundation,858538093RR0001,Christianity,Other,,,CALGARY,"",Kingdom Life Ministries Calgary,20 SILVERADO BANK COURT SW,T2X0L3,2010-08-12 00:00:00
1,KING'S BRIDGE EVANGELICAL EPISCOPAL CHURCH,Charitable Organization,871881348RR0001,Christianity,Other,,,CALGARY,WWW.CROSSTHBRIDGE.CA,KING'S BRIDGE EVANGELICAL EPISCOPAL CHURCH,50 WESTWOOD DR SW,T3C2V7,1999-02-22 00:00:00
1,"Kings' Christian Center, Calgary",Charitable Organization,807345376RR0001,Christianity,Other,,,CALGARY,WWW.KCCCALGARY.COM,"Kings' Christian Centre, Calgary",3 ASPEN VISTA WAY SW,T3H0Y7,2015-11-15 00:00:00
1,KINGS OWN CALGARY REGIMENTAL FUNDS FOUNDATION,Public Foundation,118981851RR0001,Community Resource,Military / family / veteran support,,,CALGARY,"",KINGS OWN CALGARY REGIMENTAL FUNDS FOUNDATION,4520 CROWCHILD TRAIL SW,T2T5J4,1983-11-30 00:00:00
1,KingsWord Ministries International,Charitable Organization,749629093RR0001,Christianity,Other,,,CALGARY,www.kingswordcalgary.org,KingsWord Ministries International,368 CARRINGTON WAY NW,T3P0Y9,2017-01-06 00:00:00
1,KINSMEN CARE FOUNDATION,Public Foundation,893192567RR0001,Foundations,Foundations funding community benefit QDs in general,,,CALGARY,"",KINSMEN CARE FOUNDATION,3950 12TH ST NE,T2E8H9,1992-07-01 00:00:00
1,Kinsmen Club of Calgary Foundation,Public Foundation,849325113RR0001,Foundations,Foundations funding community benefit QDs in general,,,CALGARY,KCCFOUNDATION.CA,KINSMEN CLUB OF CALGARY FOUNDATION,PO BOX 46066 RPO INGLEWOOD,T2G5H7,2010-09-08 00:00:00
1,KIWANIS CLUB OF CALGARY KAMP KIWANIS,Charitable Organization,886132190RR0001,Public Amenities,Camps / recreation,,,CALGARY,"",KIWANIS CLUB OF CALGARY KAMP KIWANIS,241001 RANGE RD 42,T3Z2X5,1988-10-12 00:00:00
1,Kleos Microfinance Group Ltd.,Charitable Organization,825075385RR0001,Organizations Relieving Poverty,Other,,,CALGARY,WWW.KLEOSMFG.ORG,KLEOS MICROFINANCE GROUP LTD.,1400 - 350 7 AVE SW,T2P3N9,2015-08-19 00:00:00
1,Knight's Cabin Medical Retreat,Charitable Organization,808417042RR0001,Supportive Health Care,Respite for caregivers of persons with serious health conditions,,,CALGARY,KNIGHTSCABIN.COM,Knight's Cabin Medical Retreat,"1213 1 STREET SW, SECOND FLOOR",T2R0V3,2013-07-25 00:00:00
1,KNOX PRESBYTERIAN CHURCH,Charitable Organization,107575730RR0001,Christianity,Presbyterian,,,CALGARY,WWW.KNOXCALGARY.CA,KNOX PRESBYTERIAN CHURCH,3704-37 ST S W,T3E3C3,1967-01-01 00:00:00
1,KNOX UNITED CHURCH,Charitable Organization,118986603RR0001,Christianity,United,,,CALGARY,KNOXUNITED.AB.CA,KNOX UNITED CHURCH,506 - 4 STREET S.W.,T2P1S7,1967-01-01 00:00:00
1,KOREAN BETHEL PRESBYTERIAN CHURCH OF CALGARY,Charitable Organization,891435471RR0001,Christianity,Other,,,CALGARY,WWW.CALGARYBETHEL.COM,KOREAN BETHEL PRESBYTERIAN CHURCH OF CALGARY,3403 - 19A SE,T2B0A6,1989-01-31 00:00:00
1,"Korean Congregation of Jehovah's Witnesses, Calgary, Alberta",Charitable Organization,744236118RR0001,Christianity,Jehovahs Witnesses,,,CALGARY,"","Korean Congregation of Jehovah's Witnesses, Calgary, Alberta",8104 BOWNESS RD NW,T3B0H6,2005-03-14 00:00:00
1,KOREAN UNITED CHURCH OF CALGARY,Charitable Organization,118987346RR0001,Christianity,United,,,CALGARY,"",KOREAN UNITED CHURCH OF CALGARY,131 7 AVE SW,T2P0W5,1985-06-18 00:00:00
1,Krabben Family Foundation,Private Foundation,807233572RR0001,Foundations,Foundations funding community benefit QDs in general,,,CALGARY,"",Krabben Family Foundation,"SUITE 403, 322 11TH AVE SW",T2R0C5,2014-06-12 00:00:00
1,Krakusy Polish Folk Dance Association,Charitable Organization,797990538RR0001,Education in the arts,Other,,,CALGARY,"",Krakusy Polish Folk Dance Association,3015 15 ST NE,T2E7L8,2019-09-26 00:00:00
1,KSBK Charitable Foundation,Private Foundation,795149699RR0001,Foundations,Foundations funding community benefit QDs in general,,,CALGARY,"",KSBK CHARITABLE FOUNDATION,166 - 918 16 AVE NW,T2M0K3,2015-10-26 00:00:00
1,LA FONDATION DE L'ENERGIE COLLECTIVE,Private Foundation,855326633RR0001,Research,Sciences / physics / chemistry,,,CALGARY,"",La fondation de l'énergie Collective,5803 - 655 CENTRE ST SW,T2G1S6,2004-09-13 00:00:00
1,LA SOCIETE DU CENTRE SCOLAIRE COMMUNAUTAIRE DE CALGARY,Charitable Organization,140669581RR0001,Teaching Institutions,Other,,,CALGARY,WWW.CITEDESROCHEUSES.COM,LA SOCIETE DU CENTRE SCOLAIRE COMMUNAUTAIRE DE CALGARY,4800 RICHARD ROAD SW,T3E6L1,1995-11-27 00:00:00
1,LA SOCIETE POMMES DE REINETTE DAYCARE,Charitable Organization,119008035RR0001,Teaching Institutions,Other,,,CALGARY,www.pommesdereinette.com,La Société Pommes de Reinette Daycare,"BUR 110, 4800, CHEM RICHARD S-O",T3E6L1,1985-09-01 00:00:00
1,LA SOCIETE PRE-MATERNELLE L'ARC-EN-CIEL,Charitable Organization,895060093RR0001,Teaching Institutions,Other,,,CALGARY,PREMATERNELLEARCENCIEL.COM,LA SOCIETE PRE-MATERNELLE L'ARC EN CIEL,4700 RICHARD RD SW,T3E6L1,1989-02-01 00:00:00
1,LAKE BONAVISTA COMMUNITY ASSOCIATION,Charitable Organization,107590390RR0001,Public Amenities,Camps / recreation,,,CALGARY,WWW.LAKEBONAVISTACOMMUNITY.COM,LAKE BONAVISTA COMMUNITY ASSOCIATION,1401 ACADIA DRIVE SE,T2J4C6,1980-01-01 00:00:00
1,LAKEVIEW UNITED CHURCH,Charitable Organization,107592479RR0001,Christianity,United,,,CALGARY,WWW.LAKEVIEWUNITEDCHURCH.COM,LAKEVIEW UNITED CHURCH,3023-63RD AVE SW,T3E5J6,1967-01-01 00:00:00
1,LAND'S END CHAMBER MUSIC SOCIETY OF CALGARY,Charitable Organization,888438827RR0001,Arts,Music (band / choral / gospel / jazz / opera / orchestral / etc.),,,CALGARY,WWW.LANDSENDENSEMBLE.CA,LAND'S END CHAMBER MUSIC SOCIETY OF CALGARY,18 STRATHLEA CRESCENT SW,T3H5A8,2004-08-25 00:00:00
1,LANTERN COMMUNITY CHRISTIAN REFORMED CHURCH OF CALGARY,Charitable Organization,872941901RR0001,Christianity,Other,,,CALGARY,LANTERNCHURCH.COM,LANTERN COMMUNITY CHRISTIAN REFORMED CHURCH OF CALGARY,1401 10 AVE SE,T2G0X1,2004-01-01 00:00:00
1,L'ARCHE ASSOCIATION OF CALGARY,Charitable Organization,132707787RR0001,Organizations Relieving Poverty,Other,,,CALGARY,"",L'ARCHE ASSOCIATION OF CALGARY,307-57 AVE SW,T2H2T6,1973-06-04 00:00:00
1,LATVIAN EVANGELICAL LUTHERAN CONGREGATION OF CALGARY,Charitable Organization,889036992RR0001,Christianity,Other,,,CALGARY,"",LATVIAN EVANGELICAL LUTHERAN CINGREGATION OF CALGARY,4729 19 AVE NW,T3B0S5,1991-07-15 00:00:00
1,Lead Foundation,Charitable Organization,863831467RR0001,Teaching Institutions,Schools for students with intellectual disabilities (physical / communicative / mental or social learning difficulties),,,CALGARY,WWW.LEADFOUNDATION.CA,LEAD FOUNDATION,"5271 MEMORIAL DR SE, SUITE 209",T2A4V1,2002-08-07 00:00:00
1,"Leadership Education and Development, Canada",Charitable Organization,832214902RR0001,Support of schools and education,Other,,,CALGARY,"","LEADERSHIP EDUCATION AND DEVELOPMENT, CANADA",2843 LIONEL CRES SW,T3E6B1,2012-04-25 00:00:00
1,Leftovers Foundation,Charitable Organization,782983522RR0001,Organizations Relieving Poverty,Other,,,CALGARY,"",Leftovers Foundation,402 8A ST NE,T2E4J3,2018-01-10 00:00:00
1,Legacy Flight Foundation,Charitable Organization,770010924RR0001,Support of schools and education,Scholarships / bursaries / awards (scholastic achievement),,,CALGARY,"",Legacy Flight Foundation,155A MACLAURIN DR,T3Z3S4,2015-10-09 00:00:00
1,Legacy Place Society,Charitable Organization,891549420RR0001,Organizations Relieving Poverty,Other,,,CALGARY,WWW.LEGACYPLACESOCIETY,Legacy Place Society,25207 BEARSPAW PL,T3R1H5,1998-09-21 00:00:00
1,LEGAL ARCHIVES SOCIETY OF ALBERTA,Charitable Organization,894166131RR0001,Public Amenities,Archives,,,CALGARY,"KIRSTEN OLSON, EXECUTIVE DIRECTOR",LEGAL ARCHIVES SOCIETY OF ALBERTA,400-1015 4TH ST SW,T2R1J4,1990-01-18 00:00:00
1,Life Connection Church,Charitable Organization,858973613RR0001,Christianity,Other,,,CALGARY,WWW.LIFECONNECTION.CA,LIFE CONNECTION CHURCH,"246 STEWART GREEN SW, SUITE 1716",T3H3C8,2007-05-08 00:00:00
1,LIFE IMPACT MINISTRIES INC.,Charitable Organization,893767863RR0001,Support of Religion,Other,,,CALGARY,"",LIFE IMPACT MINISTRIES INC,26 HARVEST GROVE GREEN NE,T3K4W5,1992-01-01 00:00:00
1,LIFE LINKS INTERNATIONAL FELLOWSHIP INC.,Charitable Organization,870728060RR0001,Support of Religion,Prayer fellowships / ministries / circles,,,CALGARY,WWW.LIFELINKS.ORG,LIFELINKS INTERNATIONAL FELLOWSHIP INC,310 - 295 MIDPARK WAY SE,T2X2A8,1998-08-10 00:00:00
1,LIFE OF FAITH CHRISTIAN CHURCH OF CALGARY,Charitable Organization,874997810RR0001,Christianity,Other,,,CALGARY,WWW.LFCCC.ORG,LIFE OF FAITH CHRISTIAN CHURCH OF CALGARY,27 SILVERADO SKIES BAY SW,T2X0K2,2001-11-01 00:00:00
1,Lifeline Christian Mission Society - Canada,Charitable Organization,803268317RR0001,Organizations Relieving Poverty,Providing low-cost housing,,,CALGARY,WWW.LIFELINEMISSION.CA,LIFELINE CHRISTIAN MISSION SOCIETY-CANADA,100 - 635 NORTHMOUNT DR NW,T2K3J6,2012-06-22 00:00:00
1,LIFESPRING COMMUNITY CHURCH,Charitable Organization,875059826RR0001,Christianity,Other,,,CALGARY,LIFESPRINGCC.CA,LIFESPRING COMMUNITY CHURCH,12 SCENIC RD NW,T3L1B1,1999-01-01 00:00:00
1,"Life-Touch Center, Ministries",Charitable Organization,813496403RR0001,Christianity,Baptist,,,CALGARY,"","Life-Touch Center, Ministries",84 FONDA CLOSE SOUTHEAST,T2A6G3,2011-04-15 00:00:00
1,Lighthouse Christian Bible Baptist Church of Alberta,Charitable Organization,842646135RR0001,Christianity,Other,,,CALGARY,"",LIGHTHOUSE CHRISTIAN BIBLE BAPTIST CHURCH OF ALBERTA,520 RANCHVIEW COURT NW,T3G1R6,2012-12-24 00:00:00
1,LIGHTHOUSE CHRISTIAN FELLOWSHIP SOCIETY OF CALGARY,Charitable Organization,879188167RR0001,Christianity,Other,,,CALGARY,WWW.CALGARYLIGHTHOUSE.COM,LIGHTHOUSE CHRISTIAN FELLOWSHIP SOCIETY OF CALGARY,UNIT O 9827 HORTON RD SW,T2V2X5,1998-12-07 00:00:00
1,Lil E Coffee Café (Calgary),Charitable Organization,700972086RR0001,Community Resource,Employment / Job training for people with physical and mental disabilities,,,CALGARY,"",Lil E Coffee Café (Calgary),321 SPYGLASS WAY,T3L0C9,2020-02-05 00:00:00
1,LILY STREET FOUNDATION,Private Foundation,868096744RR0001,Foundations,Foundations funding community benefit QDs in general,,,CALGARY,"",LILY STREET FOUNDATION,"6807 RAILWAY STREET SE, SUITE 140",T2H2V6,1999-08-18 00:00:00
1,LINKAGES SOCIETY OF ALBERTA,Charitable Organization,890910623RR0001,Relief of the Aged,"Senior's outreach programs (housekeeping / tax preparation, etc.)",,,CALGARY,WWW.LINK-AGES.CA,LINKAGES SOCIETY OF ALBERTA,130 - 720 28 ST NE,T2A6R3,1998-09-04 00:00:00
1,Lionheart Foundation,Charitable Organization,844813907RR0001,Community Resource,Youth programs and services,,,CALGARY,WWW.LIONHEARTFOUNDATION.CA,LIONHEART FOUNDATION,1100 - 110 9 AVE SW,T2P0T1,2015-06-01 00:00:00
1,Little Angels Unlimited Foundation,Private Foundation,804406015RR0001,Foundations,Foundations funding community benefit QDs in general,,,CALGARY,"",Little Angels Unlimited Foundation,2011 27 AVE SW,T2T1H6,2008-04-04 00:00:00
1,Living Channel Services Agency for Individuals with Development Disabilities Society,Charitable Organization,747806685RR0001,Organizations Relieving Poverty,Other,,,CALGARY,"",LIVING CHANNEL SERVICES AGENCY FOR INDIVIDUALS WITH DEVELOPMENTAL DISABILITIES SOCIETY,129 COVENTRY HILLS WAY NE,T3K5R2,2019-01-01 00:00:00
1,LIVING SPIRIT UNITED CHURCH,Charitable Organization,119121267RR0001,Christianity,United,,,CALGARY,WWW.LIVINGSPIRIT.CA,LIVING SPIRIT UNITED CHURCH,629-49 AVE SW,T2S1G6,1967-01-01 00:00:00
